URL,Version,Status,OIDs,Name,Title,Description,Uses,Used,Sources
http://hl7.org/fhir/ValueSet/immunization-target-disease,4.0.1,draft,"2.16.840.1.113883.4.642.3.1047",ImmunizationTargetDiseaseCodes,Immunization Target Disease Codes,"The value set to instantiate this attribute should be drawn from a terminologically robust code system that consists of or contains concepts to support describing the disease that the dose is being administered against. This value set is provided as a suggestive example and includes the SNOMED CT concepts from the 64572001 (Disease) hierarchy.","StructureDefinition/immunization-314e","SCT"
http://hl7.org/fhir/ValueSet/languages,4.0.1,draft,"2.16.840.1.113883.4.642.3.20",CommonLanguages,Common Languages,"This value set includes common codes from BCP-47 (http://tools.ietf.org/html/bcp47)","StructureDefinition/diagnosticreport-314e,StructureDefinition/episodeofcare-314e,StructureDefinition/encounter-314e,StructureDefinition/observation-antimicrobial-susceptibility-314e,StructureDefinition/patient-314e,StructureDefinition/condition-314e,StructureDefinition/attachment-314e,StructureDefinition/condition-diagnosis-314e,StructureDefinition/observation-microorganism-314e,StructureDefinition/observation-314e,StructureDefinition/careplan-314e,StructureDefinition/relatedperson-314e,StructureDefinition/condition-problem-healthconcern-314e,StructureDefinition/diagnosticreport-lab-314e,StructureDefinition/diagnosticreport-notereport-314e,StructureDefinition/servicerequest-314e,StructureDefinition/observation-microbiology-314e,StructureDefinition/immunization-314e,StructureDefinition/observation-lab-general-314e,StructureDefinition/practitioner-314e,StructureDefinition/allergyintolerance-314e,StructureDefinition/specimen-314e,StructureDefinition/documentreference-314e","hl7.terminology.r4"
http://hl7.org/fhir/ValueSet/link-type,4.0.1,active,"2.16.840.1.113883.4.642.3.423",LinkType,LinkType,"The type of link between this patient resource and another patient resource.","StructureDefinition/patient-314e","hl7.fhir.r4.core"
http://hl7.org/fhir/ValueSet/location-physical-type,4.0.1,draft,"2.16.840.1.113883.4.642.3.328",LocationType,Location type,"This example value set defines a set of codes that can be used to indicate the physical form of the Location.","StructureDefinition/encounter-314e","THO"
http://hl7.org/fhir/ValueSet/manifestation-or-symptom,4.0.1,draft,"2.16.840.1.113883.4.642.3.169",ManifestationAndSymptomCodes,Manifestation and Symptom Codes,"Example value set for Manifestation and Symptom codes.","StructureDefinition/condition-314e,StructureDefinition/condition-diagnosis-314e,StructureDefinition/condition-problem-healthconcern-314e","SCT"
http://hl7.org/fhir/ValueSet/marital-status,4.0.1,active,"2.16.840.1.113883.4.642.3.29",Marital Status Codes,MaritalStatus,"This value set defines the set of codes that can be used to indicate the marital status of a person.","StructureDefinition/patient-314e","THO (V3)"
http://hl7.org/fhir/ValueSet/medication-as-needed-reason,4.0.1,draft,"2.16.840.1.113883.4.642.3.96",SNOMEDCTMedicationAsNeededReasonCodes,SNOMED CT Medication As Needed Reason Codes,"This value set includes all clinical findings from SNOMED CT - provided as an exemplar value set.","StructureDefinition/servicerequest-314e","SCT"
http://hl7.org/fhir/ValueSet/medication-codes,4.0.1,draft,"2.16.840.1.113883.4.642.3.375",SNOMEDCTMedicationCodes,SNOMED CT Medication Codes,"This value set includes all drug or medicament substance codes and all pharmaceutical/biologic products from SNOMED CT - provided as an exemplar value set.","StructureDefinition/careplan-314e","SCT"
http://hl7.org/fhir/ValueSet/mimetypes,4.0.1,active,"2.16.840.1.113883.4.642.3.1024",Mime Types,MimeType,"This value set includes all possible codes from BCP-13 (http://tools.ietf.org/html/bcp13)","StructureDefinition/attachment-314e,StructureDefinition/documentreference-314e","Other"
http://hl7.org/fhir/ValueSet/name-use,4.0.1,active,"2.16.840.1.113883.4.642.3.65",NameUse,NameUse,"The use of a human name.","StructureDefinition/patient-314e,StructureDefinition/humanname-314e,StructureDefinition/practitioner-314e","hl7.fhir.r4.core"
http://hl7.org/fhir/ValueSet/observation-category,4.0.1,draft,"2.16.840.1.113883.4.642.3.403",ObservationCategoryCodes,Observation Category Codes,"Observation Category codes.","StructureDefinition/observation-antimicrobial-susceptibility-314e,StructureDefinition/observation-lab-general-314e,StructureDefinition/observation-microorganism-314e,StructureDefinition/observation-314e,StructureDefinition/observation-microbiology-314e","THO"
http://hl7.org/fhir/ValueSet/observation-codes,4.0.1,draft,"2.16.840.1.113883.4.642.3.396",LOINCCodes,LOINC Codes,"This value set includes all LOINC codes","StructureDefinition/observation-antimicrobial-susceptibility-314e,StructureDefinition/observation-lab-general-314e,StructureDefinition/observation-microorganism-314e,StructureDefinition/observation-314e,StructureDefinition/observation-microbiology-314e","LOINC"
http://hl7.org/fhir/ValueSet/observation-interpretation,4.0.1,active,"2.16.840.1.113883.4.642.3.399",ObservationInterpretationCodes,Observation Interpretation Codes,"A categorical assessment, providing a rough qualitative interpretation of the observation value,    such as “normal”/ “abnormal”,”low” / “high”, “better” / “worse”, “susceptible” / “resistant”, “expected”/ “not expected”.    The value set is intended to be for ANY use where coded representation of an interpretation is needed.             Notes:          This is being communicated in v2.x in OBX-8 (Observation Interpretation), in v3 in ObservationInterpretation (CWE) in R1 (Representative Realm) and in FHIR in    Observation.interpretation. Historically these values come from the laboratory domain, and these codes are extensively    used. The value set binding is extensible, so codes outside the value set that are needed for interpretation concepts    (i.e. particular meanings) that are not included in the value set can be used, and these new codes may also be added to    the value set and published in a future version.","StructureDefinition/observation-antimicrobial-susceptibility-314e,StructureDefinition/observation-lab-general-314e,StructureDefinition/observation-microorganism-314e,StructureDefinition/observation-314e,StructureDefinition/observation-microbiology-314e","THO (V3)"
http://hl7.org/fhir/ValueSet/observation-methods,4.0.1,draft,"2.16.840.1.113883.4.642.3.395",ObservationMethods,Observation Methods,"Observation Method codes from [SNOMED CT](http://snomed.info/sct) where concept is-a 272394005 (Technique (qualifier value)) or is-a 129264002 (Action (qualifier value)) or is-a 386053000 (Evaluation procedure(procedure))","StructureDefinition/observation-antimicrobial-susceptibility-314e,StructureDefinition/observation-lab-general-314e,StructureDefinition/observation-microorganism-314e,StructureDefinition/observation-314e,StructureDefinition/observation-microbiology-314e","SCT"
http://hl7.org/fhir/ValueSet/observation-status,4.0.1,active,"2.16.840.1.113883.4.642.3.400",ObservationStatus,ObservationStatus,"Codes providing the status of an observation.","StructureDefinition/observation-antimicrobial-susceptibility-314e,StructureDefinition/observation-lab-general-314e,StructureDefinition/observation-microorganism-314e,StructureDefinition/observation-314e,StructureDefinition/observation-microbiology-314e","hl7.fhir.r4.core"
http://hl7.org/fhir/ValueSet/participant-role,4.0.1,draft,"2.16.840.1.113883.4.642.3.152",ParticipantRoles,Participant Roles,"Roles of participants that may be included in a care team.  Defined as: Is a Person, Healthcare professional (occupation) or Healthcare related organization (qualifier value).","StructureDefinition/servicerequest-314e","SCT"
http://hl7.org/fhir/ValueSet/patient-contactrelationship,4.0.1,active,"2.16.840.1.113883.4.642.3.1130",PatientContactRelationship,Patient Contact Relationship ,"The nature of the relationship between the patient and the contact person.","StructureDefinition/patient-314e","THO (V2)"
http://hl7.org/fhir/ValueSet/procedure-code,4.0.1,draft,"2.16.840.1.113883.4.642.3.427",ProcedureCodes(SNOMEDCT),Procedure Codes (SNOMED CT),"Procedure Code: All SNOMED CT procedure codes.","StructureDefinition/careplan-314e","SCT"
http://hl7.org/fhir/ValueSet/quantity-comparator,4.0.1,active,"2.16.840.1.113883.4.642.3.59",QuantityComparator,QuantityComparator,"How the Quantity should be understood and represented.","StructureDefinition/quantity-314e,StructureDefinition/duration-314e,StructureDefinition/simplequantity-314e,StructureDefinition/age-314e","hl7.fhir.r4.core"
http://hl7.org/fhir/ValueSet/reaction-event-severity,4.0.1,draft,"2.16.840.1.113883.4.642.3.135",AllergyIntoleranceSeverity,AllergyIntoleranceSeverity,"Clinical assessment of the severity of a reaction event as a whole, potentially considering multiple different manifestations.","StructureDefinition/allergyintolerance-314e","hl7.fhir.r4.core"
http://hl7.org/fhir/ValueSet/referencerange-appliesto,4.0.1,draft,"2.16.840.1.113883.4.642.3.407",ObservationReferenceRangeAppliesToCodes,Observation Reference Range Applies To Codes,"This value set defines a set of codes that can be used to indicate the particular target population the reference range applies to.","StructureDefinition/observation-antimicrobial-susceptibility-314e,StructureDefinition/observation-lab-general-314e,StructureDefinition/observation-microorganism-314e,StructureDefinition/observation-314e,StructureDefinition/observation-microbiology-314e","SCT"
http://hl7.org/fhir/ValueSet/referencerange-meaning,4.0.1,draft,"2.16.840.1.113883.4.642.3.397",ObservationReferenceRangeMeaningCodes,Observation Reference Range Meaning Codes,"This value set defines a set of codes that can be used to indicate the meaning/use of a reference range for a particular target population.","StructureDefinition/observation-antimicrobial-susceptibility-314e,StructureDefinition/observation-lab-general-314e,StructureDefinition/observation-microorganism-314e,StructureDefinition/observation-314e,StructureDefinition/observation-microbiology-314e","THO"
http://hl7.org/fhir/ValueSet/relatedperson-relationshiptype,4.0.1,draft,"2.16.840.1.113883.4.642.3.449",PatientRelationshipType,Patient relationship type,"A set of codes that can be used to indicate the relationship between a Patient and a Related Person.","StructureDefinition/relatedperson-314e","THO (V3),THO (V2)"
http://hl7.org/fhir/ValueSet/report-codes,4.0.1,draft,"2.16.840.1.113883.4.642.3.233",LOINCDiagnosticReportCodes,LOINC Diagnostic Report Codes,"This value set includes LOINC codes that relate to Diagnostic Observations.","StructureDefinition/diagnosticreport-314e","LOINC"
http://hl7.org/fhir/ValueSet/request-intent,4.0.1,draft,"2.16.840.1.113883.4.642.3.113",RequestIntent,RequestIntent,"Codes indicating the degree of authority/intentionality associated with a request.","StructureDefinition/servicerequest-314e","hl7.fhir.r4.core"
http://hl7.org/fhir/ValueSet/request-priority,4.0.1,draft,"2.16.840.1.113883.4.642.3.115",RequestPriority,Request priority,"The clinical priority of a diagnostic order.","StructureDefinition/servicerequest-314e","hl7.fhir.r4.core"
http://hl7.org/fhir/ValueSet/request-status,4.0.1,draft,"2.16.840.1.113883.4.642.3.111",RequestStatus,RequestStatus,"Codes identifying the lifecycle stage of a request.","StructureDefinition/careplan-314e,StructureDefinition/servicerequest-314e","hl7.fhir.r4.core"
http://hl7.org/fhir/ValueSet/resource-types,4.0.1,active,"2.16.840.1.113883.4.642.3.27",ResourceType,ResourceType,"One of the resource types defined as part of this version of FHIR.","StructureDefinition/reference-314e,StructureDefinition/documentreference-314e","hl7.fhir.r4.core"
http://hl7.org/fhir/ValueSet/route-codes,4.0.1,draft,"2.16.840.1.113883.4.642.3.98",SNOMEDCTRouteCodes,SNOMED CT Route Codes,"This value set includes all Route codes from SNOMED CT - provided as an exemplar.","StructureDefinition/allergyintolerance-314e","SCT"
http://hl7.org/fhir/ValueSet/security-labels,4.0.1,active,"2.16.840.1.113883.4.642.3.47",All Security Labels,SecurityLabels,"A single value set for all security labels defined by FHIR.","StructureDefinition/observation-antimicrobial-susceptibility-314e,StructureDefinition/encounter-314e,StructureDefinition/observation-lab-general-314e,StructureDefinition/observation-microorganism-314e,StructureDefinition/documentreference-314e,StructureDefinition/condition-problem-healthconcern-314e,StructureDefinition/diagnosticreport-lab-314e,StructureDefinition/observation-microbiology-314e",
http://hl7.org/fhir/ValueSet/service-type,4.0.1,draft,"2.16.840.1.113883.4.642.3.518",ServiceType,Service type,"This value set defines an example set of codes of service-types.","StructureDefinition/encounter-314e","THO"
http://hl7.org/fhir/ValueSet/servicerequest-category,4.0.1,draft,"2.16.840.1.113883.4.642.3.434",ServiceRequestCategoryCodes,Service Request Category Codes,"An example value set of SNOMED CT concepts that can classify a requested service","StructureDefinition/servicerequest-314e","SCT"
http://hl7.org/fhir/ValueSet/servicerequest-orderdetail,4.0.1,draft,"2.16.840.1.113883.4.642.3.435",ServiceRequestOrderDetailsCodes,Service Request Order Details Codes,"An example value set of Codified order entry details concepts.  These concepts only make sense in the context of what is being ordered.  This example is for a patient ventilation order","StructureDefinition/servicerequest-314e","SCT"
http://hl7.org/fhir/ValueSet/specimen-collection-method,4.0.1,draft,"2.16.840.1.113883.4.642.3.468",FHIRSpecimenCollectionMethod,FHIR Specimen Collection Method," This example value set defines a set of codes that can be used to indicate the method by which a specimen was collected.","StructureDefinition/specimen-314e","SCT"
http://hl7.org/fhir/ValueSet/specimen-container-type,4.0.1,draft,"2.16.840.1.113883.4.642.3.470",SpecimenContainerType,Specimen Container Type,"Checks on the patient prior specimen collection. All SNOMED CT concepts descendants of 706041008 |Device for body fluid and tissue collection/transfer/processing (physical object)|","StructureDefinition/specimen-314e","SCT"
http://hl7.org/fhir/ValueSet/specimen-processing-procedure,4.0.1,draft,"2.16.840.1.113883.4.642.3.469",SpecimenProcessingProcedure,Specimen processing procedure,"The technique that is used to perform the process or preserve the specimen.","StructureDefinition/specimen-314e","THO (V2)"
http://hl7.org/fhir/ValueSet/specimen-status,4.0.1,draft,"2.16.840.1.113883.4.642.3.471",SpecimenStatus,SpecimenStatus,"Codes providing the status/availability of a specimen.","StructureDefinition/specimen-314e","hl7.fhir.r4.core"
http://hl7.org/fhir/ValueSet/substance-code,4.0.1,draft,"2.16.840.1.113883.4.642.3.473",SubstanceCode,Substance Code,"This value set contains concept codes for specific substances. It includes codes from [SNOMED](http://snomed.info/sct) where concept is-a 105590001 (Substance (substance)) and where concept is-a 373873005 (Pharmaceutical / biologic product (product))","StructureDefinition/allergyintolerance-314e","SCT"
http://hl7.org/fhir/ValueSet/timing-abbreviation,4.0.1,draft,"2.16.840.1.113883.4.642.3.78",TimingAbbreviation,TimingAbbreviation,"Code for a known / defined timing pattern.","StructureDefinition/timing-314e","THO (V3)"
http://hl7.org/fhir/ValueSet/units-of-time,4.0.1,active,"2.16.840.1.113883.4.642.3.77",UnitsOfTime,UnitsOfTime,"A unit of time (units from UCUM).","StructureDefinition/timing-314e","UCUM"
http://hl7.org/fhir/us/core/ValueSet/simple-language,7.0.0,active,"2.16.840.1.113883.4.642.40.2.48.4",LanguageCodesWithLanguageAndOptionallyARegionModifier,Language codes with language and optionally a region modifier,"This value set includes codes from [BCP-47](http://tools.ietf.org/html/bcp47). This value set matches the ONC 2015 Edition LanguageCommunication data element value set within C-CDA to use a 2 character language code if one exists,   and a 3 character code if a 2 character code does not exist. It points back to [RFC 5646](https://tools.ietf.org/html/rfc5646), however only the language codes are required, all other elements are optional.","StructureDefinition/patient-314e","hl7.terminology.r4"
http://hl7.org/fhir/us/core/ValueSet/us-core-clinical-result-observation-category,7.0.0,active,"2.16.840.1.113883.4.642.40.2.48.6",USCoreClinicalResultObservationCategory,US Core Clinical Result Observation Category,"Used to classify the context of clinical result observations.","StructureDefinition/observation-antimicrobial-susceptibility-314e,StructureDefinition/observation-lab-general-314e,StructureDefinition/observation-microorganism-314e,StructureDefinition/observation-microbiology-314e","THO"
http://hl7.org/fhir/us/core/ValueSet/us-core-condition-code,7.0.0,active,"2.16.840.1.113883.4.642.40.2.48.21",USCoreConditionCodes,US Core Condition Codes,"This describes the problem. Diagnosis/Problem List is broadly defined as a series of brief statements that catalog a patient's medical, nursing, dental, social, preventative and psychiatric events and issues that are relevant to that patient's healthcare (e.g., signs, symptoms, and defined conditions). ICD-10 is appropriate for Diagnosis information, and ICD-9 for historical information.","StructureDefinition/condition-diagnosis-314e,StructureDefinition/condition-problem-healthconcern-314e,StructureDefinition/servicerequest-314e","SCT,hl7.terminology.r4"
http://hl7.org/fhir/us/core/ValueSet/us-core-diagnosticreport-category,7.0.0,active,"2.16.840.1.113883.4.642.40.2.48.7",USCoreDiagnosticReportCategory,US Core Diagnostic Report Category Codes,"The US Core Diagnostic Report Category Value Set is a 'starter set' of categories supported for fetching and Diagnostic Reports and notes.","StructureDefinition/diagnosticreport-notereport-314e","LOINC"
http://hl7.org/fhir/us/core/ValueSet/us-core-diagnosticreport-report-and-note-codes,7.0.0,active,"2.16.840.1.113883.4.642.40.2.48.8",USCoreNonLaboratoryCodes,US Core Non Laboratory Codes,"This value set includes All LOINC codes defined as type ""clinical,"" therefore excluding laboratory tests, survey instruments, and claims documents. This includes observables such as vital signs, hemodynamics, intake/output, EKG, obstetric ultrasound, and cardiac echo, and includes discrete and narrative diagnostic observations and reports.","StructureDefinition/diagnosticreport-notereport-314e","LOINC"
http://hl7.org/fhir/us/core/ValueSet/us-core-documentreference-category,7.0.0,active,"2.16.840.1.113883.4.642.40.2.48.10",USCoreDocumentReferenceCategory,US Core DocumentReference Category,"The US Core DocumentReferences Category Value Set is a 'starter set' of categories supported for fetching and storing clinical notes.","StructureDefinition/documentreference-314e","hl7.fhir.us.core"
http://hl7.org/fhir/us/core/ValueSet/us-core-documentreference-type,7.0.0,active,"2.16.840.1.113883.4.642.40.2.48.11",USCoreDocumentReferenceType,US Core DocumentReference Type,"The US Core DocumentReference Type Value Set includes all LOINC values whose SCALE is ""Doc"" in the LOINC database and the HL7 v3 Code System NullFlavor concept 'unknown'","StructureDefinition/documentreference-314e","THO (V3),LOINC"
http://hl7.org/fhir/us/core/ValueSet/us-core-encounter-type,7.0.0,active,"2.16.840.1.113883.4.642.40.2.48.22",USCoreEncounterType,US Core Encounter Type,"The type of encounter: a specific code indicating type of service provided. This value set includes codes from SNOMED CT decending from the concept 308335008 (Patient encounter procedure (procedure)) and codes from the Current Procedure and Terminology (CPT) found in the following CPT sections: - 99211-99499 E/M - 99500-99600 home health (mainly nonphysician, such as newborn care in home) - 99605-99607 medication management - 98966-98968 non physician telephone services (subscription to AMA Required)","StructureDefinition/encounter-314e","SCT,hl7.terminology.r4"
http://hl7.org/fhir/us/core/ValueSet/us-core-laboratory-test-codes,7.0.0,active,"2.16.840.1.113883.4.642.40.2.48.24",USCoreLaboratoryTestCodes,US Core Laboratory Test Codes,"Laboratory LOINC codes: From the introduction to August 2022 LOINC Users' guide; ""The current scope of the existing laboratory portion of the LOINC  database includes all observations reported by clinical laboratories, including the specialty areas: chemistry, including therapeutic drug monitoring and toxicology; hematology; serology; blood bank; microbiology; cytology; surgical pathology; and fertility.","StructureDefinition/observation-antimicrobial-susceptibility-314e,StructureDefinition/observation-lab-general-314e,StructureDefinition/observation-microorganism-314e,StructureDefinition/diagnosticreport-lab-314e,StructureDefinition/observation-microbiology-314e","LOINC"
http://hl7.org/fhir/us/core/ValueSet/us-core-narrative-status,7.0.0,active,"2.16.840.1.113883.4.642.40.2.48.12",NarrativeStatus,US Core Narrative Status,"The US Core Narrative Status Value Set limits the text status for the resource narrative.","StructureDefinition/careplan-314e","hl7.fhir.r4.core"
http://hl7.org/fhir/us/core/ValueSet/us-core-problem-or-health-concern,7.0.0,active,"2.16.840.1.113883.4.642.40.2.48.25",USCoreProblemOrHealthConcern,US Core Problem or Health Concern,"Code set for category codes for *US Core Condition Problems and Health Concerns Profile* consisting of the concepts ""problem"" and ""health-concern"".","StructureDefinition/condition-problem-healthconcern-314e","hl7.fhir.us.core,THO"
http://hl7.org/fhir/us/core/ValueSet/us-core-procedure-code,7.0.0,active,"2.16.840.1.113883.4.642.40.2.48.26",USCoreProcedureCodes,US Core Procedure Codes,"Concepts from CPT, SNOMED CT, HCPCS Level II Alphanumeric Codes, ICD-10-PCS,CDT and LOINC code systems that can be used to indicate the type of procedure performed.","StructureDefinition/servicerequest-314e","SCT,LOINC,hl7.terminology.r4,Other"
http://hl7.org/fhir/us/core/ValueSet/us-core-screening-assessment-condition-category,7.0.0,active,"2.16.840.1.113883.4.642.40.2.48.17",USCoreScreeningAssessmentConditionCategory,US Core Screening Assessment Condition Category,"Category codes used in the US Core Condition Screening Assessment Profile to help identify the type of USCDI Health Status/Assessment data class being reported.","StructureDefinition/condition-problem-healthconcern-314e","hl7.fhir.us.core"
http://hl7.org/fhir/us/core/ValueSet/us-core-servicerequest-category,7.0.0,active,"2.16.840.1.113883.4.642.40.2.48.27",USCoreServiceRequestCategoryCodes,US Core ServiceRequest Category Codes,"A set of SNOMED CT and LOINC concepts to classify a requested service","StructureDefinition/servicerequest-314e","SCT,hl7.fhir.us.core"
http://hl7.org/fhir/us/core/ValueSet/us-core-simple-observation-category,7.0.0,active,"2.16.840.1.113883.4.642.40.2.48.19",USCoreSimpleObservationCategory,US Core Simple Observation Category,"Used to classify the context of a survey, screening or assessment for simple observations and may be used to assist with indexing and searching for appropriate instances.","StructureDefinition/observation-314e","hl7.fhir.us.core,THO"
http://hl7.org/fhir/us/core/ValueSet/us-core-usps-state,7.0.0,active,"2.16.840.1.113883.4.642.3.40",UspsTwoLetterAlphabeticCodes,USPS Two Letter Alphabetic Codes,"This value set defines two letter USPS alphabetic codes.","StructureDefinition/patient-314e,StructureDefinition/practitioner-314e","hl7.terminology.r4"
http://terminology.hl7.org/ValueSet/clinical-discharge-disposition,2.0.0,active,,ClinicalDischargeDisposition,Clinical Discharge Disposition,"This value set defines a set of codes that can be used to where the patient left the hospital. Note that this value set explicitly removes 'oth' (Other) to allow the binding strength to be extensible and therefore allow the exchange of additional concepts without requiring mapping to 'oth.'","StructureDefinition/encounter-314e","THO"
http://terminology.hl7.org/ValueSet/v2-0092,3.0.0,active,"2.16.840.1.113883.21.40",Hl7VSReAdmissionIndicator,hl7VS-re-admissionIndicator,"Value Set of codes which are used to specify that a patient is being re-admitted to a healthcare facility from which they were discharged, and indicates the circumstances around such re-admission.","StructureDefinition/encounter-314e","THO (V2)"
http://terminology.hl7.org/ValueSet/v2-0371,3.0.0,active,"2.16.840.1.113883.21.245",Hl7VSAdditivePreservative,hl7VS-additivePreservative,"Concepts specifying any additive introduced to the specimen before or at the time of collection.  These additives may be introduced in order to preserve, maintain or enhance the particular nature or component of the specimen.  Used in Version 2 messaging in the SPM segment.","StructureDefinition/specimen-314e","THO (V2)"
http://terminology.hl7.org/ValueSet/v2-0493,3.0.0,active,"2.16.840.1.113883.21.333",Hl7VSSpecimenCondition,hl7VS-specimenCondition,"Concepts of modes or states of being that describe the nature of a specimen.  Used in Version 2 messaging in the SPM segment.","StructureDefinition/specimen-314e","THO (V2)"
http://terminology.hl7.org/ValueSet/v2-0916,3.0.0,active,"2.16.840.1.113883.21.440",Hl7VSRelevantClincialInformation,hl7VS-relevantClincialInformation,"Value Set of codes that specify additional clinical information about the patient or specimen to report the supporting and/or suspected diagnosis and clinical findings on requests for interpreted diagnostic studies.","StructureDefinition/specimen-314e","THO (V2)"
http://terminology.hl7.org/ValueSet/v2-2.7-0360,0360,active,,v2.0360.2.7,v2 table 0360, Version 2.7,"FHIR Value set/code system definition for HL7 v2 table 0360 ver 2.9 ( Degree/License/Certificate)","StructureDefinition/practitioner-314e","THO (V2)"
