URL,Version,Status,OIDs,Name,Title,Description,Uses,Used,Sources
http://terminology.hl7.org/ValueSet/v3-ActCode,3.0.0,active,,ActCode,v3 Code System ActCode,"A code specifying the particular kind of Act that the Act-instance represents within its class.  Constraints:  The kind of Act (e.g. physical examination, serum potassium, inpatient encounter, charge financial transaction, etc.) is specified with a code from one of several, typically external, coding systems.  The coding system will depend on the class of Act, such as LOINC for observations, etc. Conceptually, the Act.code must be a specialization of the Act.classCode. This is why the structure of ActClass domain should be reflected in the superstructure of the ActCode domain and then individual codes or externally referenced vocabularies subordinated under these domains that reflect the ActClass structure. Act.classCode and Act.code are not modifiers of each other but the Act.code concept should really imply the Act.classCode concept. For a negative example, it is not appropriate to use an Act.code ""potassium"" together with and Act.classCode for ""laboratory observation"" to somehow mean ""potassium laboratory observation"" and then use the same Act.code for ""potassium"" together with Act.classCode for ""medication"" to mean ""substitution of potassium"". This mutually modifying use of Act.code and Act.classCode is not permitted.","StructureDefinition/documentreference-314e","THO (V3)"
http://terminology.hl7.org/ValueSet/v3-ActEncounterCode,3.0.0,active,"2.16.840.1.113883.1.11.13955",ActEncounterCode,ActEncounterCode,"Domain provides codes that qualify the ActEncounterClass (ENC)","StructureDefinition/encounter-314e","THO (V3)"
http://terminology.hl7.org/ValueSet/v3-ActPriority,3.0.0,active,"2.16.840.1.113883.1.11.16866",ActPriority,ActPriority,"A code or set of codes (e.g., for routine, emergency,) specifying the urgency under which the Act happened, can happen, is happening, is intended to happen, or is requested/demanded to happen.    *Discussion:* This attribute is used in orders to indicate the ordered priority, and in event documentation it indicates the actual priority used to perform the act. In definition mood it indicates the available priorities.","StructureDefinition/encounter-314e","THO (V3)"
http://terminology.hl7.org/ValueSet/v3-HL7FormatCodes,2.1.0,active,"2.16.840.1.113883.11.19752",HL7FormatCodes,HL7 ValueSet of Format Codes for use with Document Sharing,"The HL7-FormatCodes value set is defined to be the set of FormatCode(s) defined by implementation guides published by HL7 and other SDOs. The use of a formatCode from the FormatCodes value set specifies the technical format that a document conforms to. The formatCode is a further specialization more detailed than the mime-type. The formatCode provides sufficient information to allow any potential document content consumer to know if it can process and/or display the content of the document based on the document encoding, structure and template conformance indicated by the formatCode. The set of formatCodes is intended to be extensible. The Content Logical Description is defined intentionally to permit formatCodes defined by other Standards Development Organizations to be added by inclusion of additional formatCode Code Systems.","StructureDefinition/documentreference-314e","THO (V3),Other"
http://terminology.hl7.org/ValueSet/v3-ServiceDeliveryLocationRoleType,3.0.0,active,"2.16.840.1.113883.1.11.17660",ServiceDeliveryLocationRoleType,ServiceDeliveryLocationRoleType,"A role of a place that further classifies the setting (e.g., accident site, road side, work site, community location) in which services are delivered.","StructureDefinition/servicerequest-314e","THO (V3)"
