URL,Version,Status,OIDs,Name,Title,Description,Uses,Used,Sources
http://hl7.org/fhir/ValueSet/immunization-recommendation-date-criterion,4.0.1,draft,"2.16.840.1.113883.4.642.3.308",ImmunizationRecommendationDateCriterionCodes,Immunization Recommendation Date Criterion Codes,"The value set to instantiate this attribute should be drawn from a terminologically robust code system that consists of or contains concepts to support the definition of dates relevant to recommendations for future doses of vaccines. This value set is provided as a suggestive example.","StructureDefinition/immunizationrecommendation-314e","LOINC"
http://hl7.org/fhir/ValueSet/immunization-recommendation-reason,4.0.1,draft,"2.16.840.1.113883.4.642.3.307",ImmunizationRecommendationReasonCodes,Immunization Recommendation Reason Codes,"The value set to instantiate this attribute should be drawn from a terminologically robust code system that consists of or contains concepts to support describing the reasons why a given recommendation status is assigned. This value set is provided as a suggestive example and includes SNOMED CT concepts.","StructureDefinition/immunizationrecommendation-314e","SCT"
http://hl7.org/fhir/ValueSet/immunization-recommendation-status,4.0.1,draft,"2.16.840.1.113883.4.642.3.305",ImmunizationRecommendationStatusCodes,Immunization Recommendation Status Codes,"The value set to instantiate this attribute should be drawn from a terminologically robust code system that consists of or contains concepts to support describing the status of the patient towards perceived immunity against a vaccine preventable disease. This value set is provided as a suggestive example.","StructureDefinition/immunizationrecommendation-314e","THO"
http://hl7.org/fhir/ValueSet/immunization-recommendation-target-disease,4.0.1,draft,"2.16.840.1.113883.4.642.3.309",ImmunizationRecommendationTargetDiseaseCodes,Immunization Recommendation Target Disease Codes,"The value set to instantiate this attribute should be drawn from a terminologically robust code system that consists of or contains concepts to support describing the disease targeted by a vaccination recommendation. This value set is provided as a suggestive example and includes the SNOMED CT concepts from the 64572001 (Disease) hierarchy.","StructureDefinition/immunizationrecommendation-314e","SCT"
http://hl7.org/fhir/ValueSet/immunization-route,4.0.1,draft,"2.16.840.1.113883.4.642.3.289",ImmunizationRouteCodes,Immunization Route Codes,"The value set to instantiate this attribute should be drawn from a terminologically robust code system that consists of or contains concepts to support describing the administrative routes used during vaccination. This value set is provided as a suggestive example.","StructureDefinition/immunization-314e","THO (V3)"
http://hl7.org/fhir/ValueSet/immunization-site,4.0.1,draft,"2.16.840.1.113883.4.642.3.288",CodesForImmunizationSiteOfAdministration,Codes for Immunization Site of Administration,"The value set to instantiate this attribute should be drawn from a terminologically robust code system that consists of or contains concepts to support describing the body site where the vaccination occurred. This value set is provided as a suggestive example.","StructureDefinition/immunization-314e","THO (V3)"
http://hl7.org/fhir/ValueSet/immunization-status,4.0.1,draft,"2.16.840.1.113883.4.642.3.295",ImmunizationStatusCodes,Immunization Status Codes,"The value set to instantiate this attribute should be drawn from a terminologically robust code system that consists of or contains concepts to support describing the current status of the administered dose of vaccine.","StructureDefinition/immunization-314e","hl7.fhir.r4.core"
http://hl7.org/fhir/ValueSet/immunization-status-reason,4.0.1,draft,"2.16.840.1.113883.4.642.3.992",ImmunizationStatusReasonCodes,Immunization Status Reason Codes,"The value set to instantiate this attribute should be drawn from a terminologically robust code system that consists of or contains concepts to support describing the reason why a dose of vaccine was not administered. This value set is provided as a suggestive example.","StructureDefinition/immunization-314e","THO (V3),SCT"
http://hl7.org/fhir/ValueSet/immunization-subpotent-reason,4.0.1,draft,"2.16.840.1.113883.4.642.3.993",ImmunizationSubpotentReason,Immunization Subpotent Reason,"The value set to instantiate this attribute should be drawn from a terminologically robust code system that consists of or contains concepts to support describing the reason why a dose is considered to be subpotent. This value set is provided as a suggestive example.","StructureDefinition/immunization-314e","THO"
http://hl7.org/fhir/ValueSet/immunization-target-disease,4.0.1,draft,"2.16.840.1.113883.4.642.3.1047",ImmunizationTargetDiseaseCodes,Immunization Target Disease Codes,"The value set to instantiate this attribute should be drawn from a terminologically robust code system that consists of or contains concepts to support describing the disease that the dose is being administered against. This value set is provided as a suggestive example and includes the SNOMED CT concepts from the 64572001 (Disease) hierarchy.","StructureDefinition/immunization-314e","SCT"
http://hl7.org/fhir/ValueSet/investigation-sets,4.0.1,draft,"2.16.840.1.113883.4.642.3.157",InvestigationType,Investigation Type,"Example value set for investigation type.","StructureDefinition/clinicalimpression-314e","SCT"
http://hl7.org/fhir/ValueSet/languages,4.0.1,draft,"2.16.840.1.113883.4.642.3.20",CommonLanguages,Common Languages,"This value set includes common codes from BCP-47 (http://tools.ietf.org/html/bcp47)","StructureDefinition/location-314e,StructureDefinition/diagnosticreport-314e,StructureDefinition/molecularsequence-314e,StructureDefinition/careteam-314e,StructureDefinition/observation-antimicrobial-susceptibility-314e,StructureDefinition/questionnaireresponse-314e,StructureDefinition/diagnosticreport-notereport-314e,StructureDefinition/observation-microbiology-314e,StructureDefinition/immunization-314e,StructureDefinition/requestgroup-314e,StructureDefinition/task-314e,StructureDefinition/media-314e,StructureDefinition/communicationrequest-314e,StructureDefinition/nutritionorder-314e,StructureDefinition/imagingstudy-314e,StructureDefinition/documentreference-314e,StructureDefinition/encounter-314e,StructureDefinition/attachment-314e,StructureDefinition/medicationdispense-314e,StructureDefinition/group-314e,StructureDefinition/observation-lab-general-314e,StructureDefinition/endpoint-314e,StructureDefinition/goal-314e,StructureDefinition/medicationrequest-314e,StructureDefinition/substance-314e,StructureDefinition/practitioner-314e,StructureDefinition/allergyintolerance-314e,StructureDefinition/medication-314e,StructureDefinition/condition-314e,StructureDefinition/condition-diagnosis-314e,StructureDefinition/clinicalimpression-314e,StructureDefinition/visionprescription-314e,StructureDefinition/coverage-314e,StructureDefinition/schedule-314e,StructureDefinition/account-314e,StructureDefinition/contract-314e,StructureDefinition/observation-314e,StructureDefinition/relatedperson-314e,StructureDefinition/appointment-314e,StructureDefinition/organization-314e,StructureDefinition/episodeofcare-314e,StructureDefinition/patient-314e,StructureDefinition/detectedissue-314e,StructureDefinition/devicerequest-314e,StructureDefinition/observation-microorganism-314e,StructureDefinition/careplan-314e,StructureDefinition/practitionerrole-314e,StructureDefinition/condition-problem-healthconcern-314e,StructureDefinition/medicationadministration-314e,StructureDefinition/diagnosticreport-lab-314e,StructureDefinition/servicerequest-314e,StructureDefinition/slot-314e,StructureDefinition/procedure-314e,StructureDefinition/device-314e,StructureDefinition/immunizationevaluation-314e,StructureDefinition/immunizationrecommendation-314e,StructureDefinition/specimen-314e,StructureDefinition/healthcareservice-314e","hl7.terminology.r4"
http://hl7.org/fhir/ValueSet/link-type,4.0.1,active,"2.16.840.1.113883.4.642.3.423",LinkType,LinkType,"The type of link between this patient resource and another patient resource.","StructureDefinition/patient-314e","hl7.fhir.r4.core"
http://hl7.org/fhir/ValueSet/location-mode,4.0.1,draft,"2.16.840.1.113883.4.642.3.330",LocationMode,LocationMode,"Indicates whether a resource instance represents a specific location or a class of locations.","StructureDefinition/location-314e","hl7.fhir.r4.core"
http://hl7.org/fhir/ValueSet/location-physical-type,4.0.1,draft,"2.16.840.1.113883.4.642.3.328",LocationType,Location type,"This example value set defines a set of codes that can be used to indicate the physical form of the Location.","StructureDefinition/location-314e,StructureDefinition/encounter-314e","THO"
http://hl7.org/fhir/ValueSet/location-status,4.0.1,draft,"2.16.840.1.113883.4.642.3.332",LocationStatus,LocationStatus,"Indicates whether the location is still in use.","StructureDefinition/location-314e","hl7.fhir.r4.core"
http://hl7.org/fhir/ValueSet/manifestation-or-symptom,4.0.1,draft,"2.16.840.1.113883.4.642.3.169",ManifestationAndSymptomCodes,Manifestation and Symptom Codes,"Example value set for Manifestation and Symptom codes.","StructureDefinition/condition-314e,StructureDefinition/detectedissue-314e,StructureDefinition/condition-diagnosis-314e,StructureDefinition/condition-problem-healthconcern-314e","SCT"
http://hl7.org/fhir/ValueSet/marital-status,4.0.1,active,"2.16.840.1.113883.4.642.3.29",Marital Status Codes,MaritalStatus,"This value set defines the set of codes that can be used to indicate the marital status of a person.","StructureDefinition/patient-314e","THO (V3)"
http://hl7.org/fhir/ValueSet/med-admin-perform-function,4.0.1,draft,"2.16.840.1.113883.4.642.3.349",MedicationAdministration Performer Function Codes,Medication administration  performer  function  codes,"MedicationAdministration Performer Function Codes","StructureDefinition/medicationadministration-314e","THO"
http://hl7.org/fhir/ValueSet/media-modality,4.0.1,draft,"2.16.840.1.113883.4.642.3.1001",MediaModality,Media Modality,"Detailed information about the type of the image - its kind, purpose, or the kind of equipment used to generate it.","StructureDefinition/media-314e","THO"
http://hl7.org/fhir/ValueSet/media-type,4.0.1,draft,"2.16.840.1.113883.4.642.3.1000",MediaType,Media Type,"Codes for high level media categories.","StructureDefinition/media-314e","THO"
http://hl7.org/fhir/ValueSet/media-view,4.0.1,draft,"2.16.840.1.113883.4.642.3.337",MediaCollectionView/Projection,Media Collection View/Projection,"Codes defined in SNOMED CT that can be used to record Media Recording views.","StructureDefinition/media-314e","SCT"
http://hl7.org/fhir/ValueSet/medication-admin-category,4.0.1,draft,"2.16.840.1.113883.4.642.3.347",MedicationAdministration Category Codes,Medication administration  category  codes,"MedicationAdministration Category Codes","StructureDefinition/medicationadministration-314e","THO"
http://hl7.org/fhir/ValueSet/medication-admin-status,4.0.1,draft,"2.16.840.1.113883.4.642.3.340",MedicationAdministration Status Codes,Medication administration  status  codes,"MedicationAdministration Status Codes","StructureDefinition/medicationadministration-314e","THO"
http://hl7.org/fhir/ValueSet/medication-as-needed-reason,4.0.1,draft,"2.16.840.1.113883.4.642.3.96",SNOMEDCTMedicationAsNeededReasonCodes,SNOMED CT Medication As Needed Reason Codes,"This value set includes all clinical findings from SNOMED CT - provided as an exemplar value set.","StructureDefinition/dosage-314e,StructureDefinition/medicationrequest-314e,StructureDefinition/medicationdispense-314e,StructureDefinition/servicerequest-314e","SCT"
http://hl7.org/fhir/ValueSet/medication-codes,4.0.1,draft,"2.16.840.1.113883.4.642.3.375",SNOMEDCTMedicationCodes,SNOMED CT Medication Codes,"This value set includes all drug or medicament substance codes and all pharmaceutical/biologic products from SNOMED CT - provided as an exemplar value set.","StructureDefinition/careplan-314e","SCT"
http://hl7.org/fhir/ValueSet/medication-form-codes,4.0.1,draft,"2.16.840.1.113883.4.642.3.374",SNOMEDCTFormCodes,SNOMED CT Form Codes,"This value set includes all dose form codes from SNOMED CT - provided as an exemplar.","StructureDefinition/medication-314e","SCT"
http://hl7.org/fhir/ValueSet/medication-status,4.0.1,draft,"2.16.840.1.113883.4.642.3.376",Medication Status Codes,Medication  status  codes,"Medication Status Codes","StructureDefinition/medication-314e","hl7.fhir.r4.core"
http://hl7.org/fhir/ValueSet/medicationdispense-category,4.0.1,draft,"2.16.840.1.113883.4.642.3.1314",MedicationDispense Category Codes,Medication dispense  category  codes,"MedicationDispense Category Codes","StructureDefinition/medicationdispense-314e","THO"
http://hl7.org/fhir/ValueSet/medicationdispense-performer-function,4.0.1,draft,"2.16.840.1.113883.4.642.3.1318",MedicationDispense Performer Function Codes,Medication dispense  performer  function  codes,"MedicationDispense Performer Function Codes","StructureDefinition/medicationdispense-314e","THO"
http://hl7.org/fhir/ValueSet/medicationdispense-status,4.0.1,draft,"2.16.840.1.113883.4.642.3.1312",MedicationDispense Status Codes,Medication dispense  status  codes,"MedicationDispense Status Codes","StructureDefinition/medicationdispense-314e","THO"
http://hl7.org/fhir/ValueSet/medicationdispense-status-reason,4.0.1,draft,"2.16.840.1.113883.4.642.3.1316",MedicationDispense Status Reason Codes,Medication dispense  status  reason  codes,"MedicationDispense Status Codes","StructureDefinition/medicationdispense-314e","THO"
http://hl7.org/fhir/ValueSet/medicationrequest-category,4.0.1,draft,"2.16.840.1.113883.4.642.3.1322",medicationRequest Category Codes,Medication request  category  codes,"MedicationRequest Category Codes","StructureDefinition/medicationrequest-314e","THO"
http://hl7.org/fhir/ValueSet/medicationrequest-course-of-therapy,4.0.1,draft,"2.16.840.1.113883.4.642.3.1326",medicationRequest Course of Therapy Codes,Medication request  course of  therapy  codes,"MedicationRequest Course of Therapy Codes","StructureDefinition/medicationrequest-314e","THO"
http://hl7.org/fhir/ValueSet/medicationrequest-intent,4.0.1,draft,"2.16.840.1.113883.4.642.3.1321",medicationRequest Intent,Medication request  intent,"MedicationRequest Intent Codes","StructureDefinition/medicationrequest-314e","hl7.fhir.r4.core"
http://hl7.org/fhir/ValueSet/medicationrequest-status,4.0.1,draft,"2.16.840.1.113883.4.642.3.1320",medicationrequest Status,Medicationrequest  status,"MedicationRequest Status Codes","StructureDefinition/medicationrequest-314e","hl7.fhir.r4.core"
http://hl7.org/fhir/ValueSet/medicationrequest-status-reason,4.0.1,draft,"2.16.840.1.113883.4.642.3.1324",medicationRequest Status Reason Codes,Medication request  status  reason  codes,"MedicationRequest Status Reason Codes","StructureDefinition/medicationrequest-314e","THO"
http://hl7.org/fhir/ValueSet/mimetypes,4.0.1,active,"2.16.840.1.113883.4.642.3.1024",Mime Types,MimeType,"This value set includes all possible codes from BCP-13 (http://tools.ietf.org/html/bcp13)","StructureDefinition/diagnosticreport-314e,StructureDefinition/endpoint-314e,StructureDefinition/attachment-314e,StructureDefinition/signature-314e,StructureDefinition/diagnosticreport-lab-314e,StructureDefinition/diagnosticreport-notereport-314e,StructureDefinition/documentreference-314e","Other"
http://hl7.org/fhir/ValueSet/modified-foodtype,4.0.1,draft,"2.16.840.1.113883.4.642.3.388",TextureModifiedFoodTypeCodes,Texture Modified Food Type Codes,"TextureModifiedFoodType: Codes for types of foods that are texture-modified. This value set is composed SNOMED CT Concepts from SCTID 255620007 Foods (substance) and is provided as a suggestive example.","StructureDefinition/nutritionorder-314e","SCT"
http://hl7.org/fhir/ValueSet/name-use,4.0.1,active,"2.16.840.1.113883.4.642.3.65",NameUse,NameUse,"The use of a human name.","StructureDefinition/humanname-314e,StructureDefinition/patient-314e,StructureDefinition/practitioner-314e","hl7.fhir.r4.core"
http://hl7.org/fhir/ValueSet/nutrient-code,4.0.1,draft,"2.16.840.1.113883.4.642.3.386",NutrientModifierCodes,Nutrient Modifier Codes,"NutrientModifier :  Codes for types of nutrients that are being modified such as carbohydrate or sodium.  This value set includes codes from [SNOMED CT](http://snomed.info/sct) where concept is-a 226355009 (Nutrients(substance)), and the concepts for Sodium, Potassium and Fluid. This is provided as a suggestive example.","StructureDefinition/nutritionorder-314e","SCT"
http://hl7.org/fhir/ValueSet/observation-category,4.0.1,draft,"2.16.840.1.113883.4.642.3.403",ObservationCategoryCodes,Observation Category Codes,"Observation Category codes.","StructureDefinition/observation-lab-general-314e,StructureDefinition/observation-antimicrobial-susceptibility-314e,StructureDefinition/observation-microorganism-314e,StructureDefinition/observation-314e,StructureDefinition/observation-microbiology-314e","THO"
http://hl7.org/fhir/ValueSet/observation-codes,4.0.1,draft,"2.16.840.1.113883.4.642.3.396",LOINCCodes,LOINC Codes,"This value set includes all LOINC codes","StructureDefinition/observation-lab-general-314e,StructureDefinition/observation-antimicrobial-susceptibility-314e,StructureDefinition/goal-314e,StructureDefinition/observation-microorganism-314e,StructureDefinition/observation-314e,StructureDefinition/observation-microbiology-314e","LOINC"
http://hl7.org/fhir/ValueSet/observation-interpretation,4.0.1,active,"2.16.840.1.113883.4.642.3.399",ObservationInterpretationCodes,Observation Interpretation Codes,"A categorical assessment, providing a rough qualitative interpretation of the observation value,    such as “normal”/ “abnormal”,”low” / “high”, “better” / “worse”, “susceptible” / “resistant”, “expected”/ “not expected”.    The value set is intended to be for ANY use where coded representation of an interpretation is needed.             Notes:          This is being communicated in v2.x in OBX-8 (Observation Interpretation), in v3 in ObservationInterpretation (CWE) in R1 (Representative Realm) and in FHIR in    Observation.interpretation. Historically these values come from the laboratory domain, and these codes are extensively    used. The value set binding is extensible, so codes outside the value set that are needed for interpretation concepts    (i.e. particular meanings) that are not included in the value set can be used, and these new codes may also be added to    the value set and published in a future version.","StructureDefinition/observation-lab-general-314e,StructureDefinition/observation-antimicrobial-susceptibility-314e,StructureDefinition/observation-microorganism-314e,StructureDefinition/observation-314e,StructureDefinition/observation-microbiology-314e","THO (V3)"
http://hl7.org/fhir/ValueSet/observation-methods,4.0.1,draft,"2.16.840.1.113883.4.642.3.395",ObservationMethods,Observation Methods,"Observation Method codes from [SNOMED CT](http://snomed.info/sct) where concept is-a 272394005 (Technique (qualifier value)) or is-a 129264002 (Action (qualifier value)) or is-a 386053000 (Evaluation procedure(procedure))","StructureDefinition/observation-lab-general-314e,StructureDefinition/observation-antimicrobial-susceptibility-314e,StructureDefinition/observation-microorganism-314e,StructureDefinition/observation-314e,StructureDefinition/observation-microbiology-314e","SCT"
http://hl7.org/fhir/ValueSet/observation-status,4.0.1,active,"2.16.840.1.113883.4.642.3.400",ObservationStatus,ObservationStatus,"Codes providing the status of an observation.","StructureDefinition/observation-lab-general-314e,StructureDefinition/observation-antimicrobial-susceptibility-314e,StructureDefinition/detectedissue-314e,StructureDefinition/observation-microorganism-314e,StructureDefinition/observation-314e,StructureDefinition/observation-microbiology-314e","hl7.fhir.r4.core"
http://hl7.org/fhir/ValueSet/organization-type,4.0.1,draft,"2.16.840.1.113883.4.642.3.414",OrganizationType,Organization type,"This example value set defines a set of codes that can be used to indicate a type of organization.","StructureDefinition/organization-314e","THO"
http://hl7.org/fhir/ValueSet/orientation-type,4.0.1,draft,"2.16.840.1.113883.4.642.3.987",orientationType,orientationType,"Type for orientation.","StructureDefinition/molecularsequence-314e","hl7.fhir.r4.core"
http://hl7.org/fhir/ValueSet/participant-role,4.0.1,draft,"2.16.840.1.113883.4.642.3.152",ParticipantRoles,Participant Roles,"Roles of participants that may be included in a care team.  Defined as: Is a Person, Healthcare professional (occupation) or Healthcare related organization (qualifier value).","StructureDefinition/devicerequest-314e,StructureDefinition/servicerequest-314e","SCT"
http://hl7.org/fhir/ValueSet/participantrequired,4.0.1,draft,"2.16.840.1.113883.4.642.3.488",ParticipantRequired,ParticipantRequired,"Is the Participant required to attend the appointment.","StructureDefinition/appointment-314e","hl7.fhir.r4.core"
http://hl7.org/fhir/ValueSet/participationstatus,4.0.1,draft,"2.16.840.1.113883.4.642.3.486",ParticipationStatus,ParticipationStatus,"The Participation status of an appointment.","StructureDefinition/appointment-314e","hl7.fhir.r4.core"
http://hl7.org/fhir/ValueSet/patient-contactrelationship,4.0.1,active,"2.16.840.1.113883.4.642.3.1130",PatientContactRelationship,Patient Contact Relationship ,"The nature of the relationship between the patient and the contact person.","StructureDefinition/patient-314e","THO (V2)"
http://hl7.org/fhir/ValueSet/performer-role,4.0.1,draft,"2.16.840.1.113883.4.642.3.433",ProcedurePerformerRoleCodes,Procedure Performer Role Codes,"This example value set defines the set of codes that can be used to indicate a role of a procedure performer.","StructureDefinition/procedure-314e,StructureDefinition/medicationrequest-314e,StructureDefinition/task-314e","SCT"
http://hl7.org/fhir/ValueSet/procedure-category,4.0.1,draft,"2.16.840.1.113883.4.642.3.430",ProcedureCategoryCodes(SNOMEDCT),Procedure Category Codes (SNOMED CT),"Procedure Category code: A selection of relevant SNOMED CT codes.","StructureDefinition/procedure-314e","SCT"
http://hl7.org/fhir/ValueSet/procedure-code,4.0.1,draft,"2.16.840.1.113883.4.642.3.427",ProcedureCodes(SNOMEDCT),Procedure Codes (SNOMED CT),"Procedure Code: All SNOMED CT procedure codes.","StructureDefinition/careplan-314e","SCT"
http://hl7.org/fhir/ValueSet/procedure-followup,4.0.1,draft,"2.16.840.1.113883.4.642.3.429",ProcedureFollowUpCodes(SNOMEDCT),Procedure Follow up Codes (SNOMED CT),"Procedure follow up codes: A selection of SNOMED CT codes relevant to procedure follow up.","StructureDefinition/procedure-314e","SCT"
http://hl7.org/fhir/ValueSet/procedure-not-performed-reason,4.0.1,active,"2.16.840.1.113883.4.642.3.431",ProcedureNotPerformedReason(SNOMED-CT),Procedure Not Performed Reason (SNOMED-CT),"Situation codes describing the reason that a procedure, which might otherwise be expected, was not performed, or a procedure that was started and was not completed. Consists of SNOMED CT codes, children of procedure contraindicated (183932001), procedure discontinued (416406003), procedure not done (416237000), procedure not indicated (428119001), procedure not offered (416064006), procedure not wanted (416432009), procedure refused (183944003), and procedure stopped (394908001).","StructureDefinition/procedure-314e","SCT"
http://hl7.org/fhir/ValueSet/procedure-outcome,4.0.1,draft,"2.16.840.1.113883.4.642.3.428",ProcedureOutcomeCodes(SNOMEDCT),Procedure Outcome Codes (SNOMED CT),"Procedure Outcome code: A selection of relevant SNOMED CT codes.","StructureDefinition/procedure-314e","SCT"
http://hl7.org/fhir/ValueSet/procedure-reason,4.0.1,draft,"2.16.840.1.113883.4.642.3.432",ProcedureReasonCodes,Procedure Reason Codes,"This example value set defines the set of codes that can be used to indicate a reason for a procedure.","StructureDefinition/media-314e,StructureDefinition/imagingstudy-314e","SCT"
http://hl7.org/fhir/ValueSet/program,4.0.1,draft,"2.16.840.1.113883.4.642.3.1383",Program,Program,"This value set defines an example set of codes that could be can be used to classify groupings of service-types/specialties.","StructureDefinition/healthcareservice-314e","THO"
http://hl7.org/fhir/ValueSet/provenance-agent-role,4.0.1,draft,"2.16.840.1.113883.4.642.3.1305",ProvenanceParticipantRole,Provenance participant role,"The role that a provenance participant played","StructureDefinition/contract-314e","hl7.fhir.r4.core"
http://hl7.org/fhir/ValueSet/provenance-agent-type,4.0.1,draft,"2.16.840.1.113883.4.642.3.1003",ProvenanceParticipantType,Provenance participant type,"The type of participation a provenance participant.","StructureDefinition/contract-314e","THO"
http://hl7.org/fhir/ValueSet/quality-type,4.0.1,draft,"2.16.840.1.113883.4.642.3.228",qualityType,qualityType,"Type for quality report.","StructureDefinition/molecularsequence-314e","hl7.fhir.r4.core"
http://hl7.org/fhir/ValueSet/quantity-comparator,4.0.1,active,"2.16.840.1.113883.4.642.3.59",QuantityComparator,QuantityComparator,"How the Quantity should be understood and represented.","StructureDefinition/quantity-314e,StructureDefinition/duration-314e,StructureDefinition/simplequantity-314e,StructureDefinition/age-314e","hl7.fhir.r4.core"
http://hl7.org/fhir/ValueSet/questionnaire-answers,4.0.1,draft,"2.16.840.1.113883.4.642.3.446",QuestionnaireAnswerCodes,Questionnaire Answer Codes,"Example list of codes for answers to questions. (Not complete or necessarily appropriate.)","StructureDefinition/questionnaireresponse-314e","SCT"
