URL,Version,Status,OIDs,Name,Title,Description,Uses,Used,Sources
http://314e.com/fhir/ValueSet/attachment-tag,1.0.0,active,,AttachmentTagVS,Attachment Tag ValueSet,"Standard semantic tags used for categorization and workflow qualification of attachments.","StructureDefinition/attachment-tag","Internal"
http://314e.com/fhir/ValueSet/lab-category-subcategory-314e,1.0.0,draft,,LabCategorySubcategory314eVS,314e Lab Subcategories,"Procedure subcategories of Lab category used for more granular operational classification.","StructureDefinition/observation-lab-general-314e,StructureDefinition/observation-antimicrobial-susceptibility-314e,StructureDefinition/observation-microorganism-314e,StructureDefinition/observation-microbiology-314e","Internal"
http://314e.com/fhir/ValueSet/observation-tag,1.0.0,active,,ObservationTagVS,Observation Tag ValueSet,"Semantic tags used in meta.tag to qualify DiagnosticReport and Observation resources participating in hierarchical parent-child resource structures.",,"Internal"
http://314e.com/fhir/ValueSet/procedure-category-broad-314e,1.0.0,draft,,ProcedureCategoryBroad314eVS,314e Broad Procedure Categories,"Top-level operational categories for procedures and service requests.","StructureDefinition/diagnosticreport-314e,StructureDefinition/observation-314e,StructureDefinition/diagnosticreport-notereport-314e,StructureDefinition/servicerequest-314e","Internal"
http://314e.com/fhir/ValueSet/procedure-category-subcategory-314e,1.0.0,draft,,ProcedureCategorySubcategory314eVS,314e Procedure Subcategories,"Procedure subcategories used for more granular operational classification.","StructureDefinition/diagnosticreport-314e,StructureDefinition/observation-314e,StructureDefinition/diagnosticreport-lab-314e,StructureDefinition/diagnosticreport-notereport-314e,StructureDefinition/servicerequest-314e","Internal"
http://314e.com/fhir/ValueSet/time-accuracy-units,1.0.0,active,,TimeAccuracyUnitsVS314E,314e Time Exactness Units ValueSet,"Allowed exactness/ accurate precision units for dateTime, time, and instant precision indicators.","StructureDefinition/time-accuracy,StructureDefinition/datetime-accuracy","Internal"
http://314e.com/fhir/ValueSet/time-precision-units,1.0.0,active,,TimePrecisionUnitsVS314E,314e Time Precision Units ValueSet,"Allowed precision units for dateTime, time, and instant precision indicators.","StructureDefinition/datetime-precision,StructureDefinition/time-precision","Internal"
http://314e.com/fhir/ig/ValueSet/antimicrobial-susceptibility-testing-vs,1.0.0,active,,AntimicrobialSusceptibilityTestingVS,Antimicrobial Susceptibility Testing,"Observation methods for antimicrobial susceptibility testing. Includes HL7 v3 ObservationMethod code 0280 and all descendant codes.","StructureDefinition/observation-antimicrobial-susceptibility-314e","THO (V3)"
http://314e.com/fhir/ig/ValueSet/microorganism-by-method-vs,1.0.0,active,,MicroorganismByMethodVS,Microorganism by Method,"LOINC methods used to identify microorganisms.","StructureDefinition/observation-microorganism-314e","LOINC"
http://cts.nlm.nih.gov/fhir/ValueSet/2.16.840.1.113762.1.4.1010.4,20170601,active,"2.16.840.1.113762.1.4.1010.4",MedicationClinicalDrug,Medication Clinical Drug,"","StructureDefinition/medication-314e,StructureDefinition/medicationrequest-314e,StructureDefinition/medicationdispense-314e,StructureDefinition/medicationadministration-314e",
http://cts.nlm.nih.gov/fhir/ValueSet/2.16.840.1.113762.1.4.1010.6,20230715,active,"2.16.840.1.113762.1.4.1010.6",CVXVaccinesAdministeredVaccineSet,CVX Vaccines Administered Vaccine Set,"","StructureDefinition/immunization-314e,StructureDefinition/immunizationrecommendation-314e","hl7.terminology.r4"
http://cts.nlm.nih.gov/fhir/ValueSet/2.16.840.1.113762.1.4.1099.30,20190418,active,"2.16.840.1.113762.1.4.1099.30",CareTeamMemberFunction,Care Team Member Function,"Created to group the old value set from HL7 code system with the new value set using SNOMEDCT and containing the extended set of care team member roles.","StructureDefinition/careteam-314e,StructureDefinition/practitionerrole-314e",
http://cts.nlm.nih.gov/fhir/ValueSet/2.16.840.1.113762.1.4.1099.54,20221102,active,"2.16.840.1.113762.1.4.1099.54",SpecimenType,Specimen type,"","StructureDefinition/specimen-314e","SCT"
http://cts.nlm.nih.gov/fhir/ValueSet/2.16.840.1.113762.1.4.1186.8,20210622,active,"2.16.840.1.113762.1.4.1186.8",CommonSubstancesForAllergyAndIntoleranceDocumentationIncludingRefutations,Common substances for allergy and intolerance documentation including refutations,"As noted in https://jira.hl7.org/browse/FHIR-32953, Drug class value set changed 2021-06-21 to align with C-CDA member value set 2.16.840.1.113762.1.4.1114.14","StructureDefinition/allergyintolerance-314e",
http://cts.nlm.nih.gov/fhir/ValueSet/2.16.840.1.114222.4.11.1066,20190521,active,"2.16.840.1.114222.4.11.1066",HealthcareProviderTaxonomy,Healthcare Provider Taxonomy,"Code system at http://www.nucc.org/index.php?option=com_content&view=article&id=14&Itemid=125","StructureDefinition/practitionerrole-314e","Other"
http://cts.nlm.nih.gov/fhir/ValueSet/2.16.840.1.114222.4.11.3591,20221118,active,"2.16.840.1.114222.4.11.3591",PayerType,Payer Type,"Name changed on 2023-06-02 per JIRA https://jira.hl7.org/browse/FHIR-39982","StructureDefinition/coverage-314e","Internal"
http://dicom.nema.org/medical/dicom/current/output/chtml/part16/sect_CID_29.html,2025.2.20250411,active,"1.2.840.10008.6.1.19",AcquisitionModality,,"Transitive closure of CID 29 AcquisitionModality","StructureDefinition/imagingstudy-314e","Internal"
http://hl7.org/fhir/ValueSet/account-status,4.0.1,draft,"2.16.840.1.113883.4.642.3.726",AccountStatus,AccountStatus,"Indicates whether the account is available to be used.","StructureDefinition/account-314e","hl7.fhir.r4.core"
http://hl7.org/fhir/ValueSet/account-type,4.0.1,draft,"2.16.840.1.113883.4.642.3.728",AccountTypes,Account Types,"This examples value set defines the set of codes that can be used to represent the type of an account.","StructureDefinition/account-314e","THO (V3)"
http://hl7.org/fhir/ValueSet/action-cardinality-behavior,4.0.1,draft,"2.16.840.1.113883.4.642.3.807",ActionCardinalityBehavior,ActionCardinalityBehavior,"Defines behavior for an action or a group for how many times that item may be repeated.","StructureDefinition/requestgroup-314e","hl7.fhir.r4.core"
http://hl7.org/fhir/ValueSet/action-condition-kind,4.0.1,draft,"2.16.840.1.113883.4.642.3.815",ActionConditionKind,ActionConditionKind,"Defines the kinds of conditions that can appear on actions.","StructureDefinition/requestgroup-314e","hl7.fhir.r4.core"
http://hl7.org/fhir/ValueSet/action-grouping-behavior,4.0.1,draft,"2.16.840.1.113883.4.642.3.799",ActionGroupingBehavior,ActionGroupingBehavior,"Defines organization behavior of a group.","StructureDefinition/requestgroup-314e","hl7.fhir.r4.core"
http://hl7.org/fhir/ValueSet/action-precheck-behavior,4.0.1,draft,"2.16.840.1.113883.4.642.3.805",ActionPrecheckBehavior,ActionPrecheckBehavior,"Defines selection frequency behavior for an action or group.","StructureDefinition/requestgroup-314e","hl7.fhir.r4.core"
http://hl7.org/fhir/ValueSet/action-relationship-type,4.0.1,draft,"2.16.840.1.113883.4.642.3.813",ActionRelationshipType,ActionRelationshipType,"Defines the types of relationships between actions.","StructureDefinition/requestgroup-314e","hl7.fhir.r4.core"
http://hl7.org/fhir/ValueSet/action-required-behavior,4.0.1,draft,"2.16.840.1.113883.4.642.3.803",ActionRequiredBehavior,ActionRequiredBehavior,"Defines expectations around whether an action or action group is required.","StructureDefinition/requestgroup-314e","hl7.fhir.r4.core"
http://hl7.org/fhir/ValueSet/action-selection-behavior,4.0.1,draft,"2.16.840.1.113883.4.642.3.801",ActionSelectionBehavior,ActionSelectionBehavior,"Defines selection behavior of a group.","StructureDefinition/requestgroup-314e","hl7.fhir.r4.core"
http://hl7.org/fhir/ValueSet/action-type,4.0.1,draft,"2.16.840.1.113883.4.642.3.809",ActionType,ActionType,"The type of action to be performed.","StructureDefinition/requestgroup-314e","THO"
http://hl7.org/fhir/ValueSet/additional-instruction-codes,4.0.1,draft,"2.16.840.1.113883.4.642.3.95",SNOMEDCTAdditionalDosageInstructions,SNOMED CT Additional Dosage Instructions,"This value set includes all SNOMED CT Additional Dosage Instructions.","StructureDefinition/dosage-314e,StructureDefinition/medicationrequest-314e,StructureDefinition/medicationdispense-314e","SCT"
http://hl7.org/fhir/ValueSet/address-type,4.0.1,active,"2.16.840.1.113883.4.642.3.69",AddressType,AddressType,"The type of an address (physical / postal).","StructureDefinition/location-314e,StructureDefinition/patient-314e,StructureDefinition/address-314e,StructureDefinition/practitioner-314e,StructureDefinition/organization-314e","hl7.fhir.r4.core"
http://hl7.org/fhir/ValueSet/address-use,4.0.1,active,"2.16.840.1.113883.4.642.3.67",AddressUse,AddressUse,"The use of an address.","StructureDefinition/location-314e,StructureDefinition/patient-314e,StructureDefinition/address-314e,StructureDefinition/practitioner-314e,StructureDefinition/organization-314e","hl7.fhir.r4.core"
http://hl7.org/fhir/ValueSet/administration-method-codes,4.0.1,draft,"2.16.840.1.113883.4.642.3.97",SNOMEDCTAdministrationMethodCodes,SNOMED CT Administration Method Codes,"This value set includes some method codes from SNOMED CT - provided as an exemplar","StructureDefinition/dosage-314e,StructureDefinition/medicationrequest-314e,StructureDefinition/medicationdispense-314e,StructureDefinition/medicationadministration-314e","SCT"
http://hl7.org/fhir/ValueSet/administrative-gender,4.0.1,active,"2.16.840.1.113883.4.642.3.1",AdministrativeGender,AdministrativeGender,"The gender of a person used for administrative purposes.","StructureDefinition/patient-314e,StructureDefinition/practitioner-314e,StructureDefinition/relatedperson-314e","hl7.fhir.r4.core"
http://hl7.org/fhir/ValueSet/all-types,4.0.1,active,"2.16.840.1.113883.4.642.3.25",FHIRAllTypes,FHIRAllTypes,"A list of all the concrete types defined in this version of the FHIR specification - Abstract Types, Data Types and Resource Types.","StructureDefinition/datarequirement-314e","hl7.fhir.r4.core"
http://hl7.org/fhir/ValueSet/allergy-intolerance-category,4.0.1,draft,"2.16.840.1.113883.4.642.3.133",AllergyIntoleranceCategory,AllergyIntoleranceCategory,"Category of an identified substance associated with allergies or intolerances.","StructureDefinition/allergyintolerance-314e","hl7.fhir.r4.core"
http://hl7.org/fhir/ValueSet/allergy-intolerance-criticality,4.0.1,draft,"2.16.840.1.113883.4.642.3.129",AllergyIntoleranceCriticality,AllergyIntoleranceCriticality,"Estimate of the potential clinical harm, or seriousness, of a reaction to an identified substance.","StructureDefinition/allergyintolerance-314e","hl7.fhir.r4.core"
http://hl7.org/fhir/ValueSet/allergy-intolerance-type,4.0.1,draft,"2.16.840.1.113883.4.642.3.131",AllergyIntoleranceType,AllergyIntoleranceType,"Identification of the underlying physiological mechanism for a Reaction Risk.","StructureDefinition/allergyintolerance-314e","hl7.fhir.r4.core"
http://hl7.org/fhir/ValueSet/allergyintolerance-clinical,4.0.1,draft,"2.16.840.1.113883.4.642.3.1372",AllergyIntoleranceClinicalStatusCodes,AllergyIntolerance Clinical Status Codes,"Preferred value set for AllergyIntolerance Clinical Status.","StructureDefinition/allergyintolerance-314e","THO"
http://hl7.org/fhir/ValueSet/allergyintolerance-verification,4.0.1,draft,"2.16.840.1.113883.4.642.3.1370",AllergyIntoleranceVerificationStatusCodes,AllergyIntolerance Verification Status Codes,"Preferred value set for AllergyIntolerance Verification Status.","StructureDefinition/allergyintolerance-314e","THO"
http://hl7.org/fhir/ValueSet/appointment-cancellation-reason,4.0.1,draft,"2.16.840.1.113883.4.642.3.1381",AppointmentCancellationReason,Appointment cancellation reason,"This example value set defines a set of reasons for the cancellation of an appointment.","StructureDefinition/appointment-314e","THO"
http://hl7.org/fhir/ValueSet/appointmentstatus,4.0.1,draft,"2.16.840.1.113883.4.642.3.484",AppointmentStatus,AppointmentStatus,"The free/busy status of an appointment.","StructureDefinition/appointment-314e","hl7.fhir.r4.core"
http://hl7.org/fhir/ValueSet/approach-site-codes,4.0.1,draft,"2.16.840.1.113883.4.642.3.346",SNOMEDCTAnatomicalStructureForAdministrationSiteCodes,SNOMED CT Anatomical Structure for Administration Site Codes,"This value set includes Anatomical Structure codes from SNOMED CT - provided as an exemplar.","StructureDefinition/dosage-314e,StructureDefinition/medicationrequest-314e,StructureDefinition/medicationdispense-314e,StructureDefinition/medicationadministration-314e","SCT"
http://hl7.org/fhir/ValueSet/asset-availability,4.0.1,draft,"2.16.840.1.113883.4.642.3.1295",ContractResourceAssetAvailiabilityCodes,Contract Resource Asset Availiability codes,"This value set has asset availability codes.","StructureDefinition/contract-314e","hl7.fhir.r4.core"
http://hl7.org/fhir/ValueSet/body-site,4.0.1,draft,"2.16.840.1.113883.4.642.3.141",SNOMEDCTBodyStructures,SNOMED CT Body Structures,"This value set includes all codes from [SNOMED CT](http://snomed.info/sct) where concept is-a 442083009 (Anatomical or acquired body site (body structure)).","StructureDefinition/observation-antimicrobial-susceptibility-314e,StructureDefinition/condition-314e,StructureDefinition/condition-diagnosis-314e,StructureDefinition/observation-microorganism-314e,StructureDefinition/observation-314e,StructureDefinition/condition-problem-healthconcern-314e,StructureDefinition/servicerequest-314e,StructureDefinition/observation-microbiology-314e,StructureDefinition/procedure-314e,StructureDefinition/observation-lab-general-314e,StructureDefinition/media-314e,StructureDefinition/imagingstudy-314e,StructureDefinition/specimen-314e","SCT"
http://hl7.org/fhir/ValueSet/bodysite-laterality,4.0.1,draft,"2.16.840.1.113883.4.642.3.287",Laterality,Laterality,"Laterality: SNOMED-CT concepts for 'left', 'right', and 'bilateral'","StructureDefinition/imagingstudy-314e","SCT"
http://hl7.org/fhir/ValueSet/c80-facilitycodes,4.0.1,active,"2.16.840.1.113883.3.88.12.80.67",FacilityTypeCodeValueSet,Facility Type Code Value Set,"This is the code representing the type of organizational setting where the clinical encounter, service, interaction, or treatment occurred. The value set used for Healthcare Facility Type has been defined by HITSP to be the value set reproduced from HITSP C80 Table 2-147.","StructureDefinition/documentreference-314e","SCT"
http://hl7.org/fhir/ValueSet/c80-practice-codes,4.0.1,active,"2.16.840.1.113883.3.88.12.80.72",PracticeSettingCodeValueSet,Practice Setting Code Value Set,"This is the code representing the clinical specialty of the clinician or provider who interacted with, treated, or provided a service to/for the patient. The value set used for clinical specialty has been limited by HITSP to the value set reproduced from HITSP C80 Table 2-149 Clinical Specialty Value Set Definition.","StructureDefinition/slot-314e,StructureDefinition/appointment-314e,StructureDefinition/schedule-314e,StructureDefinition/healthcareservice-314e,StructureDefinition/documentreference-314e","SCT"
http://hl7.org/fhir/ValueSet/care-plan-activity-kind,4.0.1,draft,"2.16.840.1.113883.4.642.3.145",CarePlanActivityKind,Care Plan Activity Kind,"Resource types defined as part of FHIR that can be represented as in-line definitions of a care plan activity.","StructureDefinition/careplan-314e","hl7.fhir.r4.core"
http://hl7.org/fhir/ValueSet/care-plan-activity-outcome,4.0.1,draft,"2.16.840.1.113883.4.642.3.149",CarePlanActivityOutcome,Care Plan Activity Outcome,"Example codes indicating the outcome of a care plan activity. Note that these are in no way complete and might not even be appropriate for some uses.","StructureDefinition/careplan-314e","SCT"
http://hl7.org/fhir/ValueSet/care-plan-activity-status,4.0.1,draft,"2.16.840.1.113883.4.642.3.146",CarePlanActivityStatus,CarePlanActivityStatus,"Codes that reflect the current state of a care plan activity within its overall life cycle.","StructureDefinition/careplan-314e","hl7.fhir.r4.core"
http://hl7.org/fhir/ValueSet/care-plan-category,4.0.1,draft,"2.16.840.1.113883.4.642.3.148",CarePlanCategory,Care Plan Category,"Example codes indicating the category a care plan falls within.  Note that these are in no way complete and might not even be appropriate for some uses.","StructureDefinition/careplan-314e","SCT"
http://hl7.org/fhir/ValueSet/care-plan-intent,4.0.1,draft,"2.16.840.1.113883.4.642.3.150",CarePlanIntent,Care Plan Intent,"Codes indicating the degree of authority/intentionality associated with a care plan.","StructureDefinition/careplan-314e","hl7.fhir.r4.core"
http://hl7.org/fhir/ValueSet/care-team-category,4.0.1,draft,"2.16.840.1.113883.4.642.3.155",CareTeamCategory,Care Team category,"Indicates the type of care team.","StructureDefinition/careteam-314e","LOINC"
http://hl7.org/fhir/ValueSet/care-team-status,4.0.1,draft,"2.16.840.1.113883.4.642.3.153",CareTeamStatus,CareTeamStatus,"Indicates the status of the care team.","StructureDefinition/careteam-314e","hl7.fhir.r4.core"
http://hl7.org/fhir/ValueSet/chromosome-human,4.0.1,draft,"2.16.840.1.113883.4.642.3.224",chromosome-human,chromosome-human,"Chromosome number for human.","StructureDefinition/molecularsequence-314e","THO"
http://hl7.org/fhir/ValueSet/clinical-findings,4.0.1,draft,"2.16.840.1.113883.4.642.3.232",SNOMEDCTClinicalFindings,SNOMED CT Clinical Findings,"This value set includes all the ""Clinical finding"" [SNOMED CT](http://snomed.info/sct) codes - concepts where concept is-a 404684003 (Clinical finding (finding)).","StructureDefinition/diagnosticreport-314e,StructureDefinition/careteam-314e,StructureDefinition/goal-314e,StructureDefinition/careplan-314e,StructureDefinition/allergyintolerance-314e,StructureDefinition/diagnosticreport-lab-314e,StructureDefinition/diagnosticreport-notereport-314e","SCT"
http://hl7.org/fhir/ValueSet/clinicalimpression-prognosis,4.0.1,draft,"2.16.840.1.113883.4.642.3.160",ClinicalImpressionPrognosis,Clinical Impression Prognosis,"Example value set for clinical impression prognosis.","StructureDefinition/clinicalimpression-314e","SCT"
http://hl7.org/fhir/ValueSet/clinicalimpression-status,4.0.1,draft,"2.16.840.1.113883.4.642.3.1046",ClinicalImpressionStatus,Clinical Impression Status,"Codes that reflect the current state of a clinical impression within its overall lifecycle.","StructureDefinition/clinicalimpression-314e","hl7.fhir.r4.core"
http://hl7.org/fhir/ValueSet/common-tags,4.0.1,draft,"2.16.840.1.113883.4.642.3.79",CommonTags,Common Tags,"Common Tag Codes defined by FHIR project","StructureDefinition/encounter-314e,StructureDefinition/observation-lab-general-314e,StructureDefinition/observation-antimicrobial-susceptibility-314e,StructureDefinition/observation-microorganism-314e,StructureDefinition/meta-314e,StructureDefinition/condition-problem-healthconcern-314e,StructureDefinition/diagnosticreport-lab-314e,StructureDefinition/observation-microbiology-314e","THO"
http://hl7.org/fhir/ValueSet/communication-category,4.0.1,draft,"2.16.840.1.113883.4.642.3.172",CommunicationCategory,CommunicationCategory,"Codes for general categories of communications such as alerts, instructions, etc.","StructureDefinition/communicationrequest-314e","THO"
http://hl7.org/fhir/ValueSet/composition-status,4.0.1,draft,"2.16.840.1.113883.4.642.3.241",CompositionStatus,CompositionStatus,"The workflow/clinical status of the composition.","StructureDefinition/documentreference-314e","hl7.fhir.r4.core"
http://hl7.org/fhir/ValueSet/condition-category,4.0.1,draft,"2.16.840.1.113883.4.642.3.162",ConditionCategoryCodes,Condition Category Codes,"Preferred value set for Condition Categories.","StructureDefinition/condition-314e,StructureDefinition/condition-diagnosis-314e,StructureDefinition/condition-problem-healthconcern-314e","THO"
http://hl7.org/fhir/ValueSet/condition-clinical,4.0.1,draft,"2.16.840.1.113883.4.642.3.164",ConditionClinicalStatusCodes,Condition Clinical Status Codes,"Preferred value set for Condition Clinical Status.","StructureDefinition/condition-314e,StructureDefinition/condition-diagnosis-314e,StructureDefinition/condition-problem-healthconcern-314e","THO"
http://hl7.org/fhir/ValueSet/condition-code,4.0.1,draft,"2.16.840.1.113883.4.642.3.161",Condition/Problem/DiagnosisCodes,Condition/Problem/Diagnosis Codes,"Example value set for Condition/Problem/Diagnosis codes.","StructureDefinition/procedure-314e,StructureDefinition/condition-314e,StructureDefinition/devicerequest-314e,StructureDefinition/clinicalimpression-314e","SCT"
http://hl7.org/fhir/ValueSet/condition-severity,4.0.1,draft,"2.16.840.1.113883.4.642.3.168",Condition/DiagnosisSeverity,Condition/Diagnosis Severity,"Preferred value set for Condition/Diagnosis severity grading.","StructureDefinition/condition-314e,StructureDefinition/condition-diagnosis-314e,StructureDefinition/condition-problem-healthconcern-314e","SCT"
http://hl7.org/fhir/ValueSet/condition-stage,4.0.1,draft,"2.16.840.1.113883.4.642.3.170",ConditionStage,Condition Stage,"Example value set for stages of cancer and other conditions.","StructureDefinition/condition-314e,StructureDefinition/condition-diagnosis-314e,StructureDefinition/condition-problem-healthconcern-314e","SCT"
http://hl7.org/fhir/ValueSet/condition-stage-type,4.0.1,draft,"2.16.840.1.113883.4.642.3.171",ConditionStageType,Condition Stage Type,"Example value set for the type of stages of cancer and other conditions","StructureDefinition/condition-314e,StructureDefinition/condition-diagnosis-314e,StructureDefinition/condition-problem-healthconcern-314e","SCT"
http://hl7.org/fhir/ValueSet/condition-ver-status,4.0.1,draft,"2.16.840.1.113883.4.642.3.166",ConditionVerificationStatus,ConditionVerificationStatus,"The verification status to support or decline the clinical status of the condition or diagnosis.","StructureDefinition/condition-314e,StructureDefinition/condition-diagnosis-314e,StructureDefinition/condition-problem-healthconcern-314e","THO"
http://hl7.org/fhir/ValueSet/consent-content-class,4.0.1,draft,"2.16.840.1.113883.4.642.3.747",ConsentContentClass,Consent Content Class,"This value set includes the FHIR resource types, along with some other important content class codes","StructureDefinition/contract-314e","hl7.fhir.r4.core,Other"
http://hl7.org/fhir/ValueSet/consistency-type,4.0.1,draft,"2.16.840.1.113883.4.642.3.389",FluidConsistencyTypeCodes,Fluid Consistency Type Codes,"FluidConsistencyType :  Codes used to represent the consistency of fluids and liquids provided to the patient. This value set includes concepts from [SNOMED CT](http://snomed.info/sct)(US Extension) where concept is a 435681000124103  (Dietary liquid consistency diet (regime/therapy)). It is provided as a suggestive example.","StructureDefinition/nutritionorder-314e","SCT"
http://hl7.org/fhir/ValueSet/contact-point-system,4.0.1,active,"2.16.840.1.113883.4.642.3.71",ContactPointSystem,ContactPointSystem,"Telecommunications form for contact point.","StructureDefinition/patient-314e,StructureDefinition/contactpoint-314e,StructureDefinition/practitioner-314e,StructureDefinition/organization-314e,StructureDefinition/practitionerrole-314e","hl7.fhir.r4.core"
http://hl7.org/fhir/ValueSet/contact-point-use,4.0.1,active,"2.16.840.1.113883.4.642.3.73",ContactPointUse,ContactPointUse,"Use of contact point.","StructureDefinition/patient-314e,StructureDefinition/contactpoint-314e,StructureDefinition/practitioner-314e,StructureDefinition/organization-314e,StructureDefinition/practitionerrole-314e","hl7.fhir.r4.core"
http://hl7.org/fhir/ValueSet/contactentity-type,4.0.1,draft,"2.16.840.1.113883.4.642.3.416",ContactEntityType,Contact entity type,"This example value set defines a set of codes that can be used to indicate the purpose for which you would contact a contact party.","StructureDefinition/organization-314e","THO"
http://hl7.org/fhir/ValueSet/contract-action,4.0.1,draft,"2.16.840.1.113883.4.642.3.739",ContractActionCodes,Contract Action Codes,"This value set includes sample Contract Action codes.","StructureDefinition/contract-314e","THO"
http://hl7.org/fhir/ValueSet/contract-actionstatus,4.0.1,draft,"2.16.840.1.113883.4.642.3.1303",ContractResourceActionStatusCodes,Contract Resource Action Status codes,"This value set contract specific codes for action status.","StructureDefinition/contract-314e","hl7.fhir.r4.core"
http://hl7.org/fhir/ValueSet/contract-actorrole,4.0.1,draft,"2.16.840.1.113883.4.642.3.741",ContractActorRoleCodes,Contract Actor Role Codes,"This value set includes sample Contract Actor Role codes.","StructureDefinition/contract-314e","THO"
http://hl7.org/fhir/ValueSet/contract-assetcontext,4.0.1,draft,"2.16.840.1.113883.4.642.3.1297",ContractResourceAssetContextCodes,Contract Resource Asset Context codes,"This value set contract specific codes for asset context.","StructureDefinition/contract-314e","hl7.fhir.r4.core"
http://hl7.org/fhir/ValueSet/contract-assetscope,4.0.1,draft,"2.16.840.1.113883.4.642.3.1293",ContractResourceAssetScopeCodes,Contract Resource Asset Scope codes,"This value set contract specific codes for asset scope.","StructureDefinition/contract-314e","hl7.fhir.r4.core"
http://hl7.org/fhir/ValueSet/contract-assetsubtype,4.0.1,draft,"2.16.840.1.113883.4.642.3.1301",ContractResourceAssetSub-TypeCodes,Contract Resource Asset Sub-Type codes,"This value set contract specific codes for asset subtype.","StructureDefinition/contract-314e","hl7.fhir.r4.core"
http://hl7.org/fhir/ValueSet/contract-assettype,4.0.1,draft,"2.16.840.1.113883.4.642.3.1299",ContractResourceAssetTypeCodes,Contract Resource Asset Type codes,"This value set contract specific codes for asset type.","StructureDefinition/contract-314e","hl7.fhir.r4.core"
