URL,Version,Status,OIDs,Name,Title,Description,Uses,Used,Sources
http://hl7.org/fhir/ValueSet/questionnaire-answers-status,4.0.1,draft,"required",QuestionnaireResponseStatus,QuestionnaireResponseStatus,"Lifecycle status of the questionnaire response.","StructureDefinition/questionnaireresponse-314e","hl7.fhir.r4.core"
http://hl7.org/fhir/ValueSet/reaction-event-severity,4.0.1,draft,"2.16.840.1.113883.4.642.3.135",AllergyIntoleranceSeverity,AllergyIntoleranceSeverity,"Clinical assessment of the severity of a reaction event as a whole, potentially considering multiple different manifestations.","StructureDefinition/allergyintolerance-314e","hl7.fhir.r4.core"
http://hl7.org/fhir/ValueSet/reason-medication-given-codes,4.0.1,draft,"2.16.840.1.113883.4.642.3.344",ReasonMedicationGivenCodes,Reason Medication Given Codes,"This value set is provided as an example. The value set to instantiate this attribute should be drawn from a robust terminology code system that consists of or contains concepts to support the medication process.","StructureDefinition/medicationadministration-314e","THO"
http://hl7.org/fhir/ValueSet/reason-medication-not-given-codes,4.0.1,draft,"2.16.840.1.113883.4.642.3.342",SNOMEDCTReasonMedicationNotGivenCodes,SNOMED CT Reason Medication Not Given Codes,"This value set includes all medication refused, medication not administered, and non-administration of necessary drug or medicine codes from SNOMED CT - provided as an exemplar value set.","StructureDefinition/medicationadministration-314e","SCT"
http://hl7.org/fhir/ValueSet/referencerange-appliesto,4.0.1,draft,"2.16.840.1.113883.4.642.3.407",ObservationReferenceRangeAppliesToCodes,Observation Reference Range Applies To Codes,"This value set defines a set of codes that can be used to indicate the particular target population the reference range applies to.","StructureDefinition/observation-lab-general-314e,StructureDefinition/observation-antimicrobial-susceptibility-314e,StructureDefinition/observation-microorganism-314e,StructureDefinition/observation-314e,StructureDefinition/observation-microbiology-314e","SCT"
http://hl7.org/fhir/ValueSet/referencerange-meaning,4.0.1,draft,"2.16.840.1.113883.4.642.3.397",ObservationReferenceRangeMeaningCodes,Observation Reference Range Meaning Codes,"This value set defines a set of codes that can be used to indicate the meaning/use of a reference range for a particular target population.","StructureDefinition/observation-lab-general-314e,StructureDefinition/observation-antimicrobial-susceptibility-314e,StructureDefinition/observation-microorganism-314e,StructureDefinition/observation-314e,StructureDefinition/observation-microbiology-314e","THO"
http://hl7.org/fhir/ValueSet/related-artifact-type,4.0.1,draft,"2.16.840.1.113883.4.642.3.99",RelatedArtifactType,RelatedArtifactType,"The type of relationship to the related artifact.","StructureDefinition/relatedartifact-314e","hl7.fhir.r4.core"
http://hl7.org/fhir/ValueSet/relatedperson-relationshiptype,4.0.1,draft,"2.16.840.1.113883.4.642.3.449",PatientRelationshipType,Patient relationship type,"A set of codes that can be used to indicate the relationship between a Patient and a Related Person.","StructureDefinition/relatedperson-314e","THO (V3),THO (V2)"
http://hl7.org/fhir/ValueSet/report-codes,4.0.1,draft,"2.16.840.1.113883.4.642.3.233",LOINCDiagnosticReportCodes,LOINC Diagnostic Report Codes,"This value set includes LOINC codes that relate to Diagnostic Observations.","StructureDefinition/diagnosticreport-314e","LOINC"
http://hl7.org/fhir/ValueSet/repository-type,4.0.1,draft,"2.16.840.1.113883.4.642.3.230",repositoryType,repositoryType,"Type for access of external URI.","StructureDefinition/molecularsequence-314e","hl7.fhir.r4.core"
http://hl7.org/fhir/ValueSet/request-intent,4.0.1,draft,"2.16.840.1.113883.4.642.3.113",RequestIntent,RequestIntent,"Codes indicating the degree of authority/intentionality associated with a request.","StructureDefinition/requestgroup-314e,StructureDefinition/devicerequest-314e,StructureDefinition/nutritionorder-314e,StructureDefinition/servicerequest-314e","hl7.fhir.r4.core"
http://hl7.org/fhir/ValueSet/request-priority,4.0.1,draft,"2.16.840.1.113883.4.642.3.115",RequestPriority,Request priority,"The clinical priority of a diagnostic order.","StructureDefinition/requestgroup-314e,StructureDefinition/devicerequest-314e,StructureDefinition/medicationrequest-314e,StructureDefinition/task-314e,StructureDefinition/communicationrequest-314e,StructureDefinition/servicerequest-314e","hl7.fhir.r4.core"
http://hl7.org/fhir/ValueSet/request-status,4.0.1,draft,"2.16.840.1.113883.4.642.3.111",RequestStatus,RequestStatus,"Codes identifying the lifecycle stage of a request.","StructureDefinition/requestgroup-314e,StructureDefinition/devicerequest-314e,StructureDefinition/communicationrequest-314e,StructureDefinition/careplan-314e,StructureDefinition/nutritionorder-314e,StructureDefinition/servicerequest-314e","hl7.fhir.r4.core"
http://hl7.org/fhir/ValueSet/resource-types,4.0.1,active,"2.16.840.1.113883.4.642.3.27",ResourceType,ResourceType,"One of the resource types defined as part of this version of FHIR.","StructureDefinition/reference-314e","hl7.fhir.r4.core"
http://hl7.org/fhir/ValueSet/route-codes,4.0.1,draft,"2.16.840.1.113883.4.642.3.98",SNOMEDCTRouteCodes,SNOMED CT Route Codes,"This value set includes all Route codes from SNOMED CT - provided as an exemplar.","StructureDefinition/dosage-314e,StructureDefinition/medicationrequest-314e,StructureDefinition/medicationdispense-314e,StructureDefinition/allergyintolerance-314e,StructureDefinition/medicationadministration-314e","SCT"
http://hl7.org/fhir/ValueSet/security-labels,4.0.1,active,"2.16.840.1.113883.4.642.3.47",All Security Labels,SecurityLabels,"A single value set for all security labels defined by FHIR.","StructureDefinition/encounter-314e,StructureDefinition/observation-lab-general-314e,StructureDefinition/observation-antimicrobial-susceptibility-314e,StructureDefinition/observation-microorganism-314e,StructureDefinition/meta-314e,StructureDefinition/condition-problem-healthconcern-314e,StructureDefinition/diagnosticreport-lab-314e,StructureDefinition/documentreference-314e,StructureDefinition/observation-microbiology-314e",
http://hl7.org/fhir/ValueSet/sequence-quality-method,4.0.1,draft,"2.16.840.1.113883.4.642.3.223",FDA-Method,F d a- method,"This value set includes sequence quality method","StructureDefinition/molecularsequence-314e","Other"
http://hl7.org/fhir/ValueSet/sequence-quality-standardSequence,4.0.1,draft,"2.16.840.1.113883.4.642.3.222",FDA-StandardSequence,F d a- standard sequence,"This value set includes sequence quality standard","StructureDefinition/molecularsequence-314e","Other"
http://hl7.org/fhir/ValueSet/sequence-referenceSeq,4.0.1,draft,"2.16.840.1.113883.4.642.3.221",ENSEMBL,E n s e m b l,"This value set includes all Reference codes","StructureDefinition/molecularsequence-314e","Other"
http://hl7.org/fhir/ValueSet/sequence-type,4.0.1,draft,"2.16.840.1.113883.4.642.3.219",sequenceType,sequenceType,"Type if a sequence -- DNA, RNA, or amino acid sequence.","StructureDefinition/molecularsequence-314e","hl7.fhir.r4.core"
http://hl7.org/fhir/ValueSet/series-performer-function,4.0.1,draft,"2.16.840.1.113883.4.642.3.989",ImagingStudySeriesPerformerFunction,ImagingStudy series performer function,"Performer function of an agent in an imaging study series","StructureDefinition/imagingstudy-314e","THO (V3)"
http://hl7.org/fhir/ValueSet/service-category,4.0.1,draft,"2.16.840.1.113883.4.642.3.516",ServiceCategory,Service category,"This value set defines an example set of codes that can be used to classify groupings of service-types/specialties.","StructureDefinition/slot-314e,StructureDefinition/appointment-314e,StructureDefinition/schedule-314e,StructureDefinition/healthcareservice-314e","THO"
http://hl7.org/fhir/ValueSet/service-provision-conditions,4.0.1,draft,"2.16.840.1.113883.4.642.3.514",ServiceProvisionConditions,ServiceProvisionConditions,"The code(s) that detail the conditions under which the healthcare service is available/offered.","StructureDefinition/healthcareservice-314e","THO"
http://hl7.org/fhir/ValueSet/service-referral-method,4.0.1,draft,"2.16.840.1.113883.4.642.3.510",ReferralMethod,ReferralMethod,"The methods of referral can be used when referring to a specific HealthCareService resource.","StructureDefinition/healthcareservice-314e","THO"
http://hl7.org/fhir/ValueSet/service-type,4.0.1,draft,"2.16.840.1.113883.4.642.3.518",ServiceType,Service type,"This value set defines an example set of codes of service-types.","StructureDefinition/slot-314e,StructureDefinition/encounter-314e,StructureDefinition/appointment-314e,StructureDefinition/schedule-314e,StructureDefinition/healthcareservice-314e","THO"
http://hl7.org/fhir/ValueSet/servicerequest-category,4.0.1,draft,"2.16.840.1.113883.4.642.3.434",ServiceRequestCategoryCodes,Service Request Category Codes,"An example value set of SNOMED CT concepts that can classify a requested service","StructureDefinition/servicerequest-314e","SCT"
http://hl7.org/fhir/ValueSet/servicerequest-orderdetail,4.0.1,draft,"2.16.840.1.113883.4.642.3.435",ServiceRequestOrderDetailsCodes,Service Request Order Details Codes,"An example value set of Codified order entry details concepts.  These concepts only make sense in the context of what is being ordered.  This example is for a patient ventilation order","StructureDefinition/servicerequest-314e","SCT"
http://hl7.org/fhir/ValueSet/signature-type,4.0.1,draft,"1.2.840.10065.1.12",SignatureTypeCodes,Signature Type Codes,"The Digital Signature Purposes, an indication of the reason an entity signs a document. This is included in the signed information and can be used when determining accountability for various actions concerning the document. Examples include: author, transcriptionist/recorder, and witness.","StructureDefinition/signature-314e","hl7.fhir.r4.core"
http://hl7.org/fhir/ValueSet/slotstatus,4.0.1,draft,"2.16.840.1.113883.4.642.3.482",SlotStatus,SlotStatus,"The free/busy status of the slot.","StructureDefinition/slot-314e","hl7.fhir.r4.core"
http://hl7.org/fhir/ValueSet/sort-direction,4.0.1,draft,"2.16.840.1.113883.4.642.3.979",SortDirection,SortDirection,"The possible sort directions, ascending or descending.","StructureDefinition/datarequirement-314e","hl7.fhir.r4.core"
http://hl7.org/fhir/ValueSet/specimen-collection-method,4.0.1,draft,"2.16.840.1.113883.4.642.3.468",FHIRSpecimenCollectionMethod,FHIR Specimen Collection Method," This example value set defines a set of codes that can be used to indicate the method by which a specimen was collected.","StructureDefinition/specimen-314e","SCT"
http://hl7.org/fhir/ValueSet/specimen-container-type,4.0.1,draft,"2.16.840.1.113883.4.642.3.470",SpecimenContainerType,Specimen Container Type,"Checks on the patient prior specimen collection. All SNOMED CT concepts descendants of 706041008 |Device for body fluid and tissue collection/transfer/processing (physical object)|","StructureDefinition/specimen-314e","SCT"
http://hl7.org/fhir/ValueSet/specimen-processing-procedure,4.0.1,draft,"2.16.840.1.113883.4.642.3.469",SpecimenProcessingProcedure,Specimen processing procedure,"The technique that is used to perform the process or preserve the specimen.","StructureDefinition/specimen-314e","THO (V2)"
http://hl7.org/fhir/ValueSet/specimen-status,4.0.1,draft,"2.16.840.1.113883.4.642.3.471",SpecimenStatus,SpecimenStatus,"Codes providing the status/availability of a specimen.","StructureDefinition/specimen-314e","hl7.fhir.r4.core"
http://hl7.org/fhir/ValueSet/strand-type,4.0.1,draft,"2.16.840.1.113883.4.642.3.985",strandType,strandType,"Type for strand.","StructureDefinition/molecularsequence-314e","hl7.fhir.r4.core"
http://hl7.org/fhir/ValueSet/subject-type,4.0.1,draft,"2.16.840.1.113883.4.642.3.775",SubjectType,Subject type,"Possible types of subjects.","StructureDefinition/datarequirement-314e","hl7.fhir.r4.core"
http://hl7.org/fhir/ValueSet/subscriber-relationship,4.0.1,draft,"2.16.840.1.113883.4.642.3.1385",SubscriberRelationshipCodes,SubscriberPolicyholder Relationship Codes,"This value set includes codes for the relationship between the Subscriber and the Beneficiary (insured/covered party/patient).","StructureDefinition/coverage-314e","THO"
http://hl7.org/fhir/ValueSet/substance-category,4.0.1,draft,"2.16.840.1.113883.4.642.3.476",SubstanceCategoryCodes,Substance Category Codes,"Substance category codes","StructureDefinition/substance-314e","THO"
http://hl7.org/fhir/ValueSet/substance-code,4.0.1,draft,"2.16.840.1.113883.4.642.3.473",SubstanceCode,Substance Code,"This value set contains concept codes for specific substances. It includes codes from [SNOMED](http://snomed.info/sct) where concept is-a 105590001 (Substance (substance)) and where concept is-a 373873005 (Pharmaceutical / biologic product (product))","StructureDefinition/substance-314e,StructureDefinition/allergyintolerance-314e","SCT"
http://hl7.org/fhir/ValueSet/substance-status,4.0.1,draft,"2.16.840.1.113883.4.642.3.474",FHIRSubstanceStatus,FHIRSubstanceStatus,"A code to indicate if the substance is actively used.","StructureDefinition/substance-314e","hl7.fhir.r4.core"
http://hl7.org/fhir/ValueSet/supplement-type,4.0.1,draft,"2.16.840.1.113883.4.642.3.390",SupplementTypeCodes,Supplement Type Codes,"SupplementType :  Codes for nutritional supplements to be provided to the patient. This value set is composed of SNOMED CT (US Extension) Concepts from SCTID 470581016 (Enteral+supplement feeds hierarchy (product)) and is provided as a suggestive example.","StructureDefinition/nutritionorder-314e","SCT"
http://hl7.org/fhir/ValueSet/task-code,4.0.1,active,"2.16.840.1.113883.4.642.3.1396",TaskCode,Task Codes,"Codes indicating the type of action that is expected to be performed","StructureDefinition/task-314e","hl7.fhir.r4.core"
http://hl7.org/fhir/ValueSet/task-intent,4.0.1,draft,"2.16.840.1.113883.4.642.3.1240",TaskIntent,TaskIntent,"Distinguishes whether the task is a proposal, plan or full order.","StructureDefinition/task-314e","hl7.fhir.r4.core"
http://hl7.org/fhir/ValueSet/task-status,4.0.1,draft,"2.16.840.1.113883.4.642.3.790",TaskStatus,TaskStatus,"The current status of the task.","StructureDefinition/task-314e","hl7.fhir.r4.core"
http://hl7.org/fhir/ValueSet/texture-code,4.0.1,draft,"2.16.840.1.113883.4.642.3.387",TextureModifierCodes,Texture Modifier Codes,"TextureModifier: Codes for food consistency types or texture modifications to apply to foods. This value set is composed of SNOMED CT (US Extension and Core) Concepts from SCTID 229961002 Food consistency types (substance) hierarchy and is provided as a suggestive example.","StructureDefinition/nutritionorder-314e","SCT"
http://hl7.org/fhir/ValueSet/timing-abbreviation,4.0.1,draft,"2.16.840.1.113883.4.642.3.78",TimingAbbreviation,TimingAbbreviation,"Code for a known / defined timing pattern.","StructureDefinition/medicationrequest-314e,StructureDefinition/timing-314e","THO (V3)"
http://hl7.org/fhir/ValueSet/ucum-common,4.0.1,draft,,Common UCUM units,,"Commonly encountered UCUM units (for purposes of helping populate look ups.","StructureDefinition/medicationrequest-314e,StructureDefinition/medicationdispense-314e","UCUM"
http://hl7.org/fhir/ValueSet/udi-entry-type,4.0.1,draft,"2.16.840.1.113883.4.642.3.211",UDIEntryType,UDIEntryType,"Codes to identify how UDI data was entered.","StructureDefinition/device-314e","hl7.fhir.r4.core"
http://hl7.org/fhir/ValueSet/units-of-time,4.0.1,active,"2.16.840.1.113883.4.642.3.77",UnitsOfTime,UnitsOfTime,"A unit of time (units from UCUM).","StructureDefinition/medicationrequest-314e,StructureDefinition/timing-314e","UCUM"
http://hl7.org/fhir/ValueSet/vaccine-code,4.0.1,active,"2.16.840.1.113883.3.88.12.80.22",VaccineAdministeredValueSet,Vaccine Administered Value Set,"This identifies the vaccine substance administered - CVX codes.","StructureDefinition/immunizationrecommendation-314e","hl7.terminology.r4,Other"
http://hl7.org/fhir/ValueSet/vision-base-codes,4.0.1,draft,"2.16.840.1.113883.4.642.3.662",VisionBase,VisionBase,"A coded concept listing the base codes.","StructureDefinition/visionprescription-314e","hl7.fhir.r4.core"
http://hl7.org/fhir/ValueSet/vision-eye-codes,4.0.1,draft,"2.16.840.1.113883.4.642.3.660",VisionEyes,VisionEyes,"A coded concept listing the eye codes.","StructureDefinition/visionprescription-314e","hl7.fhir.r4.core"
http://hl7.org/fhir/ValueSet/vision-product,4.0.1,draft,"2.16.840.1.113883.4.642.3.658",ExampleVisionPrescriptionProductCodes,Example Vision Prescription Product Codes,"This value set includes a smattering of Prescription Product codes.","StructureDefinition/visionprescription-314e","THO"
http://hl7.org/fhir/us/core/ValueSet/simple-language,7.0.0,active,"2.16.840.1.113883.4.642.40.2.48.4",LanguageCodesWithLanguageAndOptionallyARegionModifier,Language codes with language and optionally a region modifier,"This value set includes codes from [BCP-47](http://tools.ietf.org/html/bcp47). This value set matches the ONC 2015 Edition LanguageCommunication data element value set within C-CDA to use a 2 character language code if one exists,   and a 3 character code if a 2 character code does not exist. It points back to [RFC 5646](https://tools.ietf.org/html/rfc5646), however only the language codes are required, all other elements are optional.","StructureDefinition/patient-314e","hl7.terminology.r4"
http://hl7.org/fhir/us/core/ValueSet/us-core-clinical-result-observation-category,7.0.0,active,"2.16.840.1.113883.4.642.40.2.48.6",USCoreClinicalResultObservationCategory,US Core Clinical Result Observation Category,"Used to classify the context of clinical result observations.","StructureDefinition/observation-lab-general-314e,StructureDefinition/observation-antimicrobial-susceptibility-314e,StructureDefinition/observation-microorganism-314e,StructureDefinition/observation-microbiology-314e","THO"
http://hl7.org/fhir/us/core/ValueSet/us-core-condition-code,7.0.0,active,"2.16.840.1.113883.4.642.40.2.48.21",USCoreConditionCodes,US Core Condition Codes,"This describes the problem. Diagnosis/Problem List is broadly defined as a series of brief statements that catalog a patient's medical, nursing, dental, social, preventative and psychiatric events and issues that are relevant to that patient's healthcare (e.g., signs, symptoms, and defined conditions). ICD-10 is appropriate for Diagnosis information, and ICD-9 for historical information.","StructureDefinition/procedure-314e,StructureDefinition/condition-diagnosis-314e,StructureDefinition/medicationrequest-314e,StructureDefinition/condition-problem-healthconcern-314e,StructureDefinition/servicerequest-314e","SCT,hl7.terminology.r4"
http://hl7.org/fhir/us/core/ValueSet/us-core-diagnosticreport-category,7.0.0,active,"2.16.840.1.113883.4.642.40.2.48.7",USCoreDiagnosticReportCategory,US Core Diagnostic Report Category Codes,"The US Core Diagnostic Report Category Value Set is a 'starter set' of categories supported for fetching and Diagnostic Reports and notes.","StructureDefinition/diagnosticreport-notereport-314e","LOINC"
http://hl7.org/fhir/us/core/ValueSet/us-core-diagnosticreport-report-and-note-codes,7.0.0,active,"2.16.840.1.113883.4.642.40.2.48.8",USCoreNonLaboratoryCodes,US Core Non Laboratory Codes,"This value set includes All LOINC codes defined as type ""clinical,"" therefore excluding laboratory tests, survey instruments, and claims documents. This includes observables such as vital signs, hemodynamics, intake/output, EKG, obstetric ultrasound, and cardiac echo, and includes discrete and narrative diagnostic observations and reports.","StructureDefinition/diagnosticreport-notereport-314e","LOINC"
http://hl7.org/fhir/us/core/ValueSet/us-core-documentreference-category,7.0.0,active,"2.16.840.1.113883.4.642.40.2.48.10",USCoreDocumentReferenceCategory,US Core DocumentReference Category,"The US Core DocumentReferences Category Value Set is a 'starter set' of categories supported for fetching and storing clinical notes.","StructureDefinition/documentreference-314e","hl7.fhir.us.core"
http://hl7.org/fhir/us/core/ValueSet/us-core-documentreference-type,7.0.0,active,"2.16.840.1.113883.4.642.40.2.48.11",USCoreDocumentReferenceType,US Core DocumentReference Type,"The US Core DocumentReference Type Value Set includes all LOINC values whose SCALE is ""Doc"" in the LOINC database and the HL7 v3 Code System NullFlavor concept 'unknown'","StructureDefinition/documentreference-314e","THO (V3),LOINC"
http://hl7.org/fhir/us/core/ValueSet/us-core-encounter-type,7.0.0,active,"2.16.840.1.113883.4.642.40.2.48.22",USCoreEncounterType,US Core Encounter Type,"The type of encounter: a specific code indicating type of service provided. This value set includes codes from SNOMED CT decending from the concept 308335008 (Patient encounter procedure (procedure)) and codes from the Current Procedure and Terminology (CPT) found in the following CPT sections: - 99211-99499 E/M - 99500-99600 home health (mainly nonphysician, such as newborn care in home) - 99605-99607 medication management - 98966-98968 non physician telephone services (subscription to AMA Required)","StructureDefinition/encounter-314e","SCT,hl7.terminology.r4"
http://hl7.org/fhir/us/core/ValueSet/us-core-goal-description,7.0.0,active,"2.16.840.1.113883.4.642.40.2.48.23",USCoreGoalCodes,US Core Goal Codes,"Concepts from CPT and LOINC code systems that can be used to indicate the goal.","StructureDefinition/goal-314e","SCT,LOINC"
http://hl7.org/fhir/us/core/ValueSet/us-core-laboratory-test-codes,7.0.0,active,"2.16.840.1.113883.4.642.40.2.48.24",USCoreLaboratoryTestCodes,US Core Laboratory Test Codes,"Laboratory LOINC codes: From the introduction to August 2022 LOINC Users' guide; ""The current scope of the existing laboratory portion of the LOINC  database includes all observations reported by clinical laboratories, including the specialty areas: chemistry, including therapeutic drug monitoring and toxicology; hematology; serology; blood bank; microbiology; cytology; surgical pathology; and fertility.","StructureDefinition/observation-lab-general-314e,StructureDefinition/observation-antimicrobial-susceptibility-314e,StructureDefinition/observation-microorganism-314e,StructureDefinition/diagnosticreport-lab-314e,StructureDefinition/observation-microbiology-314e","LOINC"
http://hl7.org/fhir/us/core/ValueSet/us-core-narrative-status,7.0.0,active,"2.16.840.1.113883.4.642.40.2.48.12",NarrativeStatus,US Core Narrative Status,"The US Core Narrative Status Value Set limits the text status for the resource narrative.","StructureDefinition/careplan-314e","hl7.fhir.r4.core"
http://hl7.org/fhir/us/core/ValueSet/us-core-problem-or-health-concern,7.0.0,active,"2.16.840.1.113883.4.642.40.2.48.25",USCoreProblemOrHealthConcern,US Core Problem or Health Concern,"Code set for category codes for *US Core Condition Problems and Health Concerns Profile* consisting of the concepts ""problem"" and ""health-concern"".","StructureDefinition/condition-problem-healthconcern-314e","hl7.fhir.us.core,THO"
http://hl7.org/fhir/us/core/ValueSet/us-core-procedure-code,7.0.0,active,"2.16.840.1.113883.4.642.40.2.48.26",USCoreProcedureCodes,US Core Procedure Codes,"Concepts from CPT, SNOMED CT, HCPCS Level II Alphanumeric Codes, ICD-10-PCS,CDT and LOINC code systems that can be used to indicate the type of procedure performed.","StructureDefinition/procedure-314e,StructureDefinition/servicerequest-314e","SCT,LOINC,hl7.terminology.r4,Other"
http://hl7.org/fhir/us/core/ValueSet/us-core-screening-assessment-condition-category,7.0.0,active,"2.16.840.1.113883.4.642.40.2.48.17",USCoreScreeningAssessmentConditionCategory,US Core Screening Assessment Condition Category,"Category codes used in the US Core Condition Screening Assessment Profile to help identify the type of USCDI Health Status/Assessment data class being reported.","StructureDefinition/condition-problem-healthconcern-314e","hl7.fhir.us.core"
http://hl7.org/fhir/us/core/ValueSet/us-core-servicerequest-category,7.0.0,active,"2.16.840.1.113883.4.642.40.2.48.27",USCoreServiceRequestCategoryCodes,US Core ServiceRequest Category Codes,"A set of SNOMED CT and LOINC concepts to classify a requested service","StructureDefinition/servicerequest-314e","SCT,hl7.fhir.us.core"
http://hl7.org/fhir/us/core/ValueSet/us-core-simple-observation-category,7.0.0,active,"2.16.840.1.113883.4.642.40.2.48.19",USCoreSimpleObservationCategory,US Core Simple Observation Category,"Used to classify the context of a survey, screening or assessment for simple observations and may be used to assist with indexing and searching for appropriate instances.","StructureDefinition/observation-314e","hl7.fhir.us.core,THO"
http://hl7.org/fhir/us/core/ValueSet/us-core-usps-state,7.0.0,active,"2.16.840.1.113883.4.642.3.40",UspsTwoLetterAlphabeticCodes,USPS Two Letter Alphabetic Codes,"This value set defines two letter USPS alphabetic codes.","StructureDefinition/location-314e,StructureDefinition/patient-314e,StructureDefinition/practitioner-314e,StructureDefinition/organization-314e","hl7.terminology.r4"
http://loinc.org/vs/LL379-9|4.0.1,null,active,,LOINCAnswersLL379-9|4.0.1,LOINC Answer Codes for LL379-9|4.0.1,"","StructureDefinition/molecularsequence-314e","LOINC"
http://terminology.hl7.org/ValueSet/clinical-discharge-disposition,2.0.0,active,,ClinicalDischargeDisposition,Clinical Discharge Disposition,"This value set defines a set of codes that can be used to where the patient left the hospital. Note that this value set explicitly removes 'oth' (Other) to allow the binding strength to be extensible and therefore allow the exchange of additional concepts without requiring mapping to 'oth.'","StructureDefinition/encounter-314e","THO"
